,questions,answers
0,Q. 1. Briefly describe the process of German unification. ,Ans. Refer to Ans. of Q.1. Long Answer Type Questions.
1,"Q. 2. Examine the conditions of Italy before Term-II,  2012] unification. [Board Term-II,","Ans. Conditions of Italy before unification :  Political fragmentation.  Italians were scattered over several dynastic states as well as the multi-national Habsburg Em pire.  During the middle of the 19 th century, Italy was divided into seven states.  Out of seven, only one Sardinia-Piedmont was ruled by an Italian Princely House.  The North was under Austrian Habsburgs.  The centre was ruled by the Pope.  Southern regions were under Bourbon kings of Spain. 1 mark each 3 marks each  The Italian language had not acquired one comm on form. It still had many regional and local variations.  ½ × 6 = 3"
2,Q. 3. Describe the process by which Italy was unified. ,Ans. Refer to Ans. of Q.2. Lo ng Answer Type Questions.
3,Q. 4. Who was Cavour ? Explain his contributions to the unification of Italy. ,Ans. Cavour was the Chief Minister of SardiniaPiedmont. His contribution to the unification of Italy was :  He was a good administrator.  He worked for the unification of Italy. Through a tactful diplomatic alliance with France engineered by Cavour Sardinia-piedmont.  He led the movement to unify the regions of Italy.  He was a tactful diplomat. He succeeded in defeating the Austrian forces in 1859.  1 + 2 = 3 
4,Q. 5. What changes came came in Nationalism in Europe after 1848 ? Who was the architect of this process? How was it practised ? ,Ans.  Europe moved away from its association with democracy and revolution. Conservatives promoted state power and political domination.  Otto von Bismarck was the architect of this process.  It was backed by the army and bureaucracy.  1 × 3 = 3
5,Q. 6. How did Nationalism develop through culture in Europe ? Explain. ,"Ans. Nationalism developed through culture in Europe:  Culture played an important role in creating the idea of the nation, art and poetry, stories and music helped to express and shape nationalist feelings.  Romanticism, a cultural movement which sought to develop a particular form of nationalist sentiment. Romantic artists and poets generally criticized the glorification of reason and science and focussed instead on emotions, intuition and mystical feelings.  German philosopher Johann Gottfried Herder claimed that true German culture was to be discovered among the common people- das volk. It was through folk songs, folk poetry and folk dances that the true spirit of a nation was popularised.  The emphasis on vernacular language and the collection of local folklore was used to carry the modern nationalist message to large audiences who were mostly illiterates.  1× 3 = 3"
