,questions,answers
0,"Q. 1. Explain the terms : Net attendance Ratio and [Board Term-I erm-I,, NCT-2014] Literacy Rate.",Ans.  Net Attendance Attendance Ratio Ratio : Total number of children of age group 6-10 attending school as a percentage of total number of children in the same age group.  Literacy Rate : Proportion of literate population in the age group of 7 years and above.
1,Q. 2. Explain the concept of ‘Human Development’ with an example.,Ans.  Human development means that education and health are an important part to achieve well-being of the human resource.  Human development development indicates that the human mind becomes efficient to perform task of highlyskilled nature when proper education is provided to them and a healthy life style is available.  For example : Every human being has a basic right to get a good education and better health facilities. Those countries which provide the basic necessities of life progress faster than those countries which do not have these facilities.
2,"Q. 3. Explain the three components of Human Development Index.  [Board Term-I erm-I,, , 2014] Write the importance of human development index [Board Term-I erm-I,, , 2012] in three points. Write a note on Human Development [Board Term-I, Term-I, , (580022, 24, 29, Index.","Ans. Human Development Index is published by the UNDP.  It indicates indicates the level of development of a country. country.  It indicates to a country how far it has travelled and how far it has yet to travel to achieve high ranks in matters such as per capita income of the people.  One comes to know the important important welfare elements such as life expectancy, literacy, educational level of people and health status.  1×3=3"
3,"Q. 4. On the basis of which three indicators of HDI 2004 Sri Lanka has better rank than India ? [Board Term-I, Term-I, , 2016-17] 3 marks each",Ans.  Life expectancy  Gross enrollment ratio ratio  Per capita income  3
4,"Q. 5. Which three efforts should be made by any country to improve its HDI ? [Board Term-I, Term-I, Set-M, DDE-2015]",Ans. The three efforts which could be made by any country to improve its HDI are :  providing 100% literacy to the people.  improving health facilities. facilities.  creating a pollution free environment.  1 × 3 = 3
5,"Q. 6. Apart from income, which other six things people look for growth and development ?  [Board Term-I, Term-I,  2016-17]  Give same example where factors other than income are important aspects of own lives.","Ans.  Apart from income, people also seek things like equal treatment, freedom, security and respect of others.  They resent discrimination. All these are important goals.  In fact, fact, in some cases, these may be more important than more income or more consumption because material goods are not all that you need to live.  Money or material things that that one can buy with it is one factor on which our life depends.  1×3=3"
6,Q. 7. State any three factors other than income that are important in life. ,Ans.  Infant Mortality Rate : It is an indicator of the availability of doctors and medical facilities in the region as well the awareness of the people living there in regard to diseases and their prevention. ) Literacy Rate : This is an indicator of the number of (ii schools and teachers available in a region and also indicates whether the facilities are being used or not due to societal pressures.  Life Expectancy : This is also an indicator of available health facilities. Low life expectancy is a hindrance to economic development.
