,questions,answers
0,Q. 1. List four observations that help us to determine whether a chemical reaction has taken place.,Ans. (i) Evolution of a gas (ii) Change in temperature (2 marks each) (iii) Change in state (iv) Change in colour. 
1,Q. 11. Translate the following statement into chemical equation and then balance it : ‘‘A metal in the form of ribbon burns with a dazzling white flame and changes into a white powder.’ ,Ans. Magnesium combines with atmospheric oxygen to form magnesium oxide. → 2MgO 2Mg + O2  
2,Q. 12. State what happens when zinc granules are heated with sodium hydroxide solution. Write the balanced chemical equation for the reaction. Name the main product formed in this reaction. ,"Ans. When zinc granules are heated with NaOH solution, sodium zincate is formed with the evolution of hydrogen gas. Heat 2NaOH(aq) + Zn(s) → Na2ZnO2(aq) + H2(g) The main product formed in this reaction is H2 gas. 2"
3,"Q. 13. Give reactions of calcium and magnesium with dilute nitric acid. [Board Term-I, Set-WJ7QPA9; Set-3R6WRQL, 2013] → Ca(NO3)2 + H2",Ans. Ca + 2HNO3  → Mg(NO3)2 + H2 Mg + 2HNO3  
4,Q. 14. Write balanced chemical equations for the following reactions : (i) Silver bromide on exposure to sunlight decomposes into silver and bromine. (ii) Sodium metal reacts with water to form sodium hydroxide and hydrogen gas.  Sunlight,Ans. (i) 2AgBr(s) → 2Ag(s) + Br2(g) → 2NaOH(aq) + H2(g) (ii) 2Na(s) + 2H2O(l)  
5,"Q. 15 In a test-tube, hydrochloric acid is poured over a few zinc granules. List two observations that suggest that a chemical reaction has occurred. → ZnCl2 + H2 2HCl + Zn  [Board Term-I 2012 Set (47) (NCERT Exemplar)]",Ans. (i) A colourless gas is evolved. (ii) Test-tube becomes hot. 
6,Q. 16. Convert the following statements into balanced chemical equations : (i) Zinc reacts with sulphuric acid to form zinc sulphate and hydrogen gas. (ii) Magnesium burns in oxygen to form magnesium oxide. [Board Term-I Set (48) 2012] → ZnSO4 + H2,Ans. (i) Zn + H2SO4  → 2MgO (ii) 2Mg + O2  
7,Q. 17. Write the balanced chemical equations for the following reactions. (a) Calcium hydroxide + Carbon dioxide → Calcium carbonate + Water (b) Zinc + Silver nitrate → Zinc nitrate + Silver (c) Aluminium + Copper chloride → Aluminium chloride + Copper (d) Barium chloride + Potassium sulphate → Barium sulphate + Potassium chloride ,Ans. (a) Ca(OH)2 + CO2 → CaCO3 + H2O (b) Zn + 2AgNO3 → Zn (NO3)2 + 2Ag (c) 2Al + 3CuCl2 → 2AlCl3 + 3Cu (d) BaCl2 + K2SO4 → BaSO4 + 2KCl
8,Q. 1. Define a chemical reaction. Which observation help you to determine whether a chemical reaction has taken place ? ,Ans. Chemical Reaction : Refer to Very Short Answer Type
9,Q. 2. Define the term decomposition reaction. Give one example each of thermal decomposition and electrolytic decomposition. ,"Ans. N2 + H2  (i) Examine the number of atoms of different elements present in the unbalanced equation. (ii) In the above reaction, left hand N2 and H2 of both the sides are unbalanced. (iii) To balance hydrogen, H2 is multiplied by 3 on side. It makes 6H- atoms on the left hand side. (iv) Now to balance hydrogen atoms on the right hand side, NH3 should be multiplied by 2. It makes 6Hatoms on this side. (v) Now to balance nitrogen atoms, they are counted separately for both the sides and we will find that, nitrogen atoms are 2 on both the sides. (vi) Balanced chemical equation will be : → 2NH3 ½+½+½+½+½+½ N2 + 3H2 "
10,Q. 4. (a) Mention the four informations given by an equation. (b) State the law of conservation of mass as applicable in a chemical reaction. ,"Ans. (a) (i) Physical state of reactants and products. (ii) Conditions such as temperature, pressure, heat etc. (iii) Catalyst involved. (iv) Change in state. (b) Total mass of the elements present in the products in a chemical reaction has to be equal to the total mass of elements present in the reactants or Mass can neither be created nor destroyed in a chemical reaction.  1"
11,"Q. 5. When a copper wire was left in silver nitrate solution for sometime, it was observed that the solution turned bluish green. (i) Explain the observation. (ii) Write the balanced chemical equation to represent the change taking place. ","Ans. (i) Copper is more reactive than silver. Hence, when copper wire is dipped in silver nitrate solution, it displaces silver from AgNO3 solution forming copper nitrate which is bluish green in colour. (ii) Cu + 2AgNO3 → Cu(NO3)2 + 2Ag Copper (II) nitrate Silver bluish green  1½ + 1½"
12,Q. 6. 2 g ferrous sulphate crystals are heated in a dry boiling tube. (i) List any two observations. (ii) Name the type of chemical reaction taking place. (iii) Write the chemical equation of the reaction. ,"Ans. (i) Before heating, it is pale green. After heating, it is brown or reddish brown. Two observations are : 		(a) Change in state and colour. 		(b) Evolution of gas. (ii) Decomposition reaction. Heat → Fe2O3(s) + SO2(g) + SO3(g) (iii) 2FeSO4(s) "
13,"Q. 7. (a) In the following reactions, name the reactants, which undergo oxidation and reduction : → Cu(s) + H2O(g) (i) CuO(s) + H2(g)  → ZnO(s) + Cu(s) (ii) CuO(s) + Zn(s)  (b) State one industrial application of reduction. ",Ans. (a) (i) The reactants are copper oxide and hydrogen. Copper oxide undergoes reaction and hydrogen (H2) undergoes oxidation. (ii) The reactants are copper oxide and zinc. Zinc undergoes oxidation and copper oxide undergoes reduction. (b) Calcium carbonate is reduced in industries to get CaO and CO2.
14,Q. 8. (a) Write chemical equations. (i) When carbon dioxide gas is passed through lime water. (ii) When excess of carbon dioxide gas is passed through lime water. (b) List two natural forms of calcium carbonate.  → CaCO3 + H2O,Ans. (a) (i) Ca(OH)2 + CO2  → CaCO3(s) + (ii) Ca(OH)2(aq) + CO2(g)  H2O(l) → Ca(HCO3)2 (aq) CaCO3(s) + H2O(l) + CO2(g)  (b) Aragonite and calcite
15,Q. 9. Identify the type of each of the following reactions. Also write balanced chemical equation for each. (i) The reaction mixture becomes warm. (ii) An insoluble substance is formed. ,Ans. (i) Exothermic Reaction → Ca(OH)2 CaO + H2O  (ii) Double displacement reaction. → BaSO4 + 2NaCl 1½ + 1½ BaCl2 + Na2SO4  
16,Q. 10. (i) Solution of a substance ‘X’ is used for testing carbon dioxide. Write the equation of the reaction of ‘X’ with carbon dioxide. (ii) How is ‘X’ obtained ? Write chemical equation. ,Ans. (i) Substance X-Calcium Hydroxide. → CaCO3(s) + H2O Ca(OH)2(aq) + CO2(g)  (White ppt.) (ii) Calcium hydroxide is obtained by reaction of calcium oxide and water. → Ca(OH)2(aq) + Heat 1 + 2 CaO(s) + H2O(l) 
17,Q. 11. What happens when : (i) Dilute hydrochloric acid is added to solid sodium carbonate. (ii) Quicklime is treated with water. (iii) Sodium chloride solution is added to lead nitrate solution. Also write the chemical equation in each case.  → 2NaCl(aq) +,Ans. (i) Na2CO3(s) + 2HCl(aq)  H2O(l) + CO2(g) → Ca(OH)2(aq) + Heat (ii) CaO(s) + H2O(l)  → PbCl2(s) + (iii) Pb(NO3)2(aq) + NaCl(aq)  2NaNO3(aq) 
18,Q. 12. Write the chemical equation of the reaction with an example each in which the following change has taken place : (i) Change in colour (ii) Change in temperature (iii) Formation of precipitate. ,"Ans. (i) Change in colour : Reaction between lead nitrate solution and potassium iodide solution. → PbI2(s) + 2KNO3(aq) Pb(NO3)2(aq) + 2KI  In this reaction, colour changes from colourless to yellow. (ii) Change in temperature : Action of dilute sulphuric acid on zinc. → ZnSO4(aq) + H2 Zn(s) + H2SO4(aq)  In this reaction, heat is evolved (iii) Formation of precipitate : Action of barium chloride on sodium sulphate. → BaSO4(s) + 2NaCl(aq) BaCl2(aq) + Na2SO4(aq)  ppt.  1+1+1"
19,Q. 13. Complete and balance the following chemical equations : (i) CaCO3 + HCl (ii) Al + HCl (iii) MnO2 + HCl  → CaCl2(s) + H2O(l),Ans. (i) CaCO3(s) + 2HCl(aq)  + CO2(g) → 2AlCl3(aq) + 3H2(g) (ii) 2Al(s) + 6HCl(aq)  → MnCl2 + 2H2O(l) + (iii) MnO2 + 4HCl(aq)  Cl2(g) 1+1+1 
20,Q. 14. Write balanced chemical equations for the following reactions : (i) dilute sulphuric acid reacts with aluminium powder. (ii) dilute hydrochloric acid reacts with sodium carbonate. (iii) Carbon-dioxide is passed through lime water.  → Al2(SO4)3 + 3H2,Ans. (i) 2Al + 3H2SO4  → 2NaCl + H2O + CO2 (ii) Na2CO3 + 2HCl  → CaCO3 + H2O (iii) Ca(OH)2 + CO2  
21,Q. 15. Balance the following chemical equations and state whether they are exothermic or endothermic : (i) Na + H2O → NaOH + H2 (ii) FeSO4 → Fe2O3 + SO2 + SO3 ,Ans. (i) 2Na + 2H2O → 2NaOH + H2 It is an exothermic reaction. → Fe2O3 + SO2(g) + SO3(g) (ii) 2FeSO4(s)  It is an endothermic reaction.
22,Q. 16. Write the chemical equations involved in the following chemical reactions : (i) White washing. (ii) Black and white photography. ,"Ans. (i) In white washing, quicklime reacts with water to form slaked lime. CaO + H2O → Ca(OH)2 + Heat Quick lime Slaked lime (ii) Silver bromide, when exposed to light decomposes to silver and bromine. Sunlight 2 AgBr(s) → 2 Ag(s) + (Silver bromide) (Silver) Br2(g) (Bromine)  1½ + 1½"
23,Q. 17. 2 g of ferrous sulphate crystals are heated in a boiling tube. (i) State the colour of ferrous sulphate crystals both before heating and after heating. (ii) Name the gases produced during heating. (iii) Write the chemical equation for the reaction. ,Ans. (i) Before heating : Pale green After heating : Brown or reddish brown. (ii) SO2 and SO3. (iii) 2FeSO4(s) Heat → Fe2O3(s) + SO2(g) + SO3(g) 
