question,answer,context
What are the reasons for growing concerns about the environment? ,Environment concern is a very serious issue because of the following facts: (i) Cultivable area throughout the world is decreasing and losing in fertility. (ii) Water bodies getting polluted due to pollution. (iii) Rapid decline in the total amount of ozone in the earth’s stratosphere. (iv) Global coastal pollution has increased due to land based activities.,"Q.1. Why there is a sharp decline in the quality of coastal pollution? Ans. 1. Coastal land-based activities 2. Intensive human settlement in coastal zones. Q.2. Why have fishing industries been destroyed in the Aral sea? Ans. Around the Aral sea, toxic water have completely destroyed the fishing industry. Q.3. What was the point of concern of Northern States in ‘Rio Summit’? Ans. Northern states were concerned with Ozone depletion and global warming. Q.4. Why is it said that history of petroleum is also the history of war and struggles? [CBSE (AI) 2016] Ans. It is true because World Economy is based on petroleum and immense wealth is associated with oil. It generates political struggles and wars to have control over it. Q.5. What was the cause of worry of Southern states? Ans. Southern states were anxious to address the relationship between economic development and environmental management. Q.6. What is way of ‘Sustainable development’? Ans. ‘Sustainable development’ is an approach of economic development without harming the environment. Q.7. What is the role of Antarctica continent with respect to world atmosphere? Ans. Antarctica maintains climate equilibrium in the world. Q.8. How is marine ecosystem of Antarctica? Ans. Antarctica has a highly productive marine ecosystem, comprising of few plants (e.g., microscopic algae, fungi and lichen) marine mammal, fish and hoards of birds adapted to harsh conditions. Q.9. What are the reasons for increase in pollution in Antarctica? Ans. Globally, coastal pollution is increasing. Although the open sea is relatively clean, the coastal waters are becoming increasingly polluted largely due to land-based activities. Q.10. Why has land environment been an issue?
 Ans. Land environment is an issue because throughout the world, cultivable area is barely expanding anymore and a substantial portion of existing agricultural land is losing futility, grasslands have been overgrazed and fisheries over harvested. Water bodies have suffered extensive depletion. Q.11. Why did thousands of people have to leave their homes around the Aral sea? Ans. Around the Aral sea, thousands of people had to leave their homes as the toxic water has completely destroyed the fishing industry. The shipping industry and all related activities have collapsed. Rising concentration of salt has caused low crop yields. Numerous studies have been conducted but no solution to the problems has been found. Q.12. Identify the most important outcome of the Rio Summit. [CBSE (AI) 2015] Ans. Outcomes of Rio Summit: (i) The Rio Summit produced conventions dealing with climate change, biodiversity, forestry, etc. (ii) It recommended a list of developmental practices called ‘Agenda 21.’ (iii) There was consensus on sustainable development. (Any one) Q.13. What changes can be seen in the outer atmosphere of the Earth? Ans. Amount of Ozone gas is decreasing due to the hole in the ozone layer of atmosphere. A steady decline in the total amount of ozone in the Earth’s stratosphere poses a real danger to the ecosystems and human health. Q.14. What is the importance of ‘Antarctica Region’? Ans. Antarctic plays an important role in maintaining climatic equilibrium and deep ice cores provide an important source of information about greenhouse gas concentrations and atmospheric temperatures of hundred and thousands of years ago. It comprises 90 per cent of all terrestrial ice and 70 per cent of planetary fresh water. Q.15. Why have issues related to global environmental protection become a priority concern of states since the 1990s? [NCERT] Ans. The consequences on environment due to economic development were felt by various countries from 1960. In 1990s, issues related to global environmental protection became the priority concerns. The growing focus on environmental issues within the arena of global politics was firmly consolidated at the United Nations conference on Environment and Development held in Rio de Janeiro, Brazil, in June 1992. This was also called the Earth Summit. The Summit
 2. Similar and cooperative behaviour towards Global Common should be there. Responsibilities are common but roles are different. Thus, role should be played by all. Q.3. What are the reasons for growing concerns about the environment? [CBSE Sample Paper 2015] Ans. Environment concern is a very serious issue because of the following facts: (i) Cultivable area throughout the world is decreasing and losing in fertility. (ii) Water bodies getting polluted due to pollution. (iii) Rapid decline in the total amount of ozone in the earth’s stratosphere. (iv) Global coastal pollution has increased due to land based activities. Q.4. Why is mineral industry criticised and opposed in different parts of the world? Ans. Following are the reasons why mineral industry is being criticised and opposed in different parts of world: 1. 2. 3. 4. 5.
 "
Why is mineral industry criticised and opposed in different parts of the world?,"Following are the reasons why mineral industry is being criticised and opposed in different parts of world: 1. 2. 3. 4. 5.  The mineral industry’s extraction of earth. Its use of chemicals. Its pollution of waterways and land. Its clearance of native vegetation. Its displacement of communities.  One example that can be cited is of the Philippines, where a vast network of groups and organisations campaigned against the Western Mining Corporation (WMC), an Australia-based multinational company.","2. Similar and cooperative behaviour towards Global Common should be there. Responsibilities are common but roles are different. Thus, role should be played by all. Q.3. What are the reasons for growing concerns about the environment? [CBSE Sample Paper 2015] Ans. Environment concern is a very serious issue because of the following facts: (i) Cultivable area throughout the world is decreasing and losing in fertility. (ii) Water bodies getting polluted due to pollution. (iii) Rapid decline in the total amount of ozone in the earth’s stratosphere. (iv) Global coastal pollution has increased due to land based activities. Q.4. Why is mineral industry criticised and opposed in different parts of the world? Ans. Following are the reasons why mineral industry is being criticised and opposed in different parts of world: 1. 2. 3. 4. 5.
 The mineral industry’s extraction of earth. Its use of chemicals. Its pollution of waterways and land. Its clearance of native vegetation. Its displacement of communities.
 The mineral industry’s extraction of earth. Its use of chemicals. Its pollution of waterways and land. Its clearance of native vegetation. Its displacement of communities.
 "
Explain the role of Environment Movements to meet the challenge of Environmental Degradation. ,"Environmental movements meet the challenge of environmental degradation by: (i) Social movements such as the Chipko movement resist the degradation of their surrounding environment and become a popular movement. (ii) They ensure information campaigns in school, colleges and through popular media to highlight issues of environmental degradation. (iii) They pressurise governments to effectively combat climate change such as in Paris negotiations. (iv) These movements began ground campaigns such as cleaning beaches, etc. and thereby involve public participation. ","[NCERT] Ans. It has become essential to adopt some ways of environment conservation because of environment degradation due to economic development. But this poses a great threat to pace of economic development. It is a serious challenge in front of world to adopt such approach which neither affect or degrade the environment nor slows down the pace of economic development. From state level to international level steps and initiatives have been taken in this direction. Most significant responses to this challenge have come not from the governments but rather from groups of environmentally conscious volunteers working in different part of the world. It is within social movements that new forms of political action are born on reinvented. These movements raise new ideas and long-term visions of what we should do and what we should not do in our individual and collective lives. Here are just a few examples to show that diversity is an important trait of contemporary environmental movements. 1. Movement in Favour of forest: Forest clearing in the Third world countries at an alarming rate, despite three decades of environmental activism. The destruction of the world’s last remaining grand forests has actually increased in last decade. The forest movement of the South, in Mexico, Chile, Brazil, Malaysia, Indonesia, Continental Africa and India, etc. are faced with enormous pressures. 2. Mines Related Movements: The minerals industry is one of the most powerful forms of industry on the planet. A large number of economies of the South are now being reopened to MNCs through the liberalisation of the global economy. The mineral industry’s extraction of earth, its use of chemicals, its pollution of waterways and land, its clearance of native vegetation, its displacements of community, amongst other factors, continue to invite criticism and resistance in various parts of the world. One example is that of the Philippines, where a vast network of groups and organisations campaigned against the Western Mining Corporation (WMC), an Australia-based multinational company. Much opposition to the company in its own country. 3. Dam Opposing Movements: Another groups of movements are those involved in struggles against mega dams. In every country where a mega dam is being built, one is likely to find an environmental movement opposing it. Increasingly antidam movements are pro-river movements for more sustainable and equitablemanagement of river systems and valleys. The early 1980s saw the first anti-dam movement launched in the North, namely, the campaign to save the Franklin River and its surrounding forests in Australia. At present, there has been a spurt in mega- dam building in the South, from Turkey to Thailand to South Africa, from Indonesia to China. India has had some of the leading anti-dam pro river movements. Narmada Bachao Andolan and Tehri movement are examples of such movements. It is significant note that, in anti-dam and other environmental movements in India, the most important shared idea is nonviolence. Q.20. Explain the arguments in favour of India on environment related issues. [CBSE Delhi 2013]
 Or Explain arguments in favour of India on any three issues of environment. [CBSE (AI) 2014] Ans. Arguments in favour of India on issues related to environment are as follows: 1. India signed and ratified the 1997 Kyoto Protocol in August 2002. India, China and other developing countries were exempted from the requirement of the Kyoto Protocol because their contribution to the emission of greenhouse gases during the industrialisation period was not significant. However, at the G-8 meeting in June2005, India pointed out that the per capita emission rates of developing countries are a tiny fraction of those in the developed world. Following the principle of common but differentiated responsibilities. India is of the view that the major responsibility of curbing emission rests with the developed countries, which have accumulated emissions over a long period of time. 2. India’s international negotiating position relies heavily on principles of historical responsibility, as enshrined in UNFCCC. This acknowledges that developed countries are responsible for most historical and current greenhouse gas emissions, and emphasizes that economic and socio development are the first and overridingpriorities of the developing country parties’, so India is wary of recent discussions within UNFCCC about introducing binding commitments on speedily industrialising countries to reduce their greenhouse gas emissions. India feels the controversies that very spirit of UNFCCC. Neither does it seem fair to impose restrictions on India when the country’s rise in per capita carbon emission by 2030 is likely to still represent less than half the world average of 3.8 tonnes in 2000. Indian emissions are predicted to rise from 0.9 tonnes per capita in 2000 to 1.6 tonnes per capita in 2030. 3. The Indian government is already participating in global efforts through a number of programmes. For example, India’s National Auto-fuel Policy mandates cleaner fuels for vehicles. The Energy Conservation Act, passed in 2001, outlines initiatives to improve energy efficiency. Similarly, the Electricity Act of 2003 advocates and promotes the use of renewable energy. Recent trends in importing natural gas and encouraging the adoption of clean coal technologies show that India has been making true efforts. The government also intended to launch a National Mission on Biodiesel, using about 11 million hectares of land to produce bio diesel by 2011-12. And India has one of the largest renewable energy programmes in the world. 4. A review of the implementation of the agreements at the Earth Summit in Rio was undertaken by India at 1997. One of the key conclusions was that there had been no meaningful progress with respect to transfer of new and additional financial resources and environmentally sound technology on concessional terms to developing nations. India encourage SAARC countries to adopt a common position on major global environmental issues, so that the region’s voice carries greater weight. Q.21. Compromise and accommodation are the two essential policies required by states to save planet Earth. Substantiate the statement in the light of the ongoing negotiations between the North and South on environmental issues.
 [NCERT] Ans. Issues of environment is not just related to any individual or country, rather it is related to all those people of countries living on Earth. Thus, in order to save it, mutual and cooperative efforts are required instead of individual efforts. It is important that every country adopts the policy of resolvement and cooperation. There is difference in the approach to environment between the countries of the North and the South. The developed countries of the North want to discuss the environmental issue as it stands now and wants everyone to be equally responsible for ecological conservation. The developing countries of the south feel that much of the ecological degradation in the world is the result of industrial development undertaken by the developed countries. If they have caused more degradation, they must also take more responsibility for undoing the damage now. Moreover, the developing countries are in the process of industrialisation and they must not be subjected to the same restrictions, which apply to the developed countries. Thus, the special needs of the developing countries must be taken into consideration in the development, application, and interpretation of rules of international environmental law. This argument was accepted in the Rio Declaration at the Earth Summit in 1992 and is called the principle of Common but differentiated responsibilities. The 1992 United Nations Framework Convention on Climate Change (UNFCCC) also provides that the parties should act to protect the climate system on the basis of equity and in accordance with their common but differentiated responsibilities. The parties to the Convention, agreed that the largest share of historical and current global emissions of greenhouse gases has originated in developed countries. It was also acknowledged that per capita emissions in developing countries are still relatively low. China, India, and other developing countries were, therefore, exempted from the requirements of the Kyoto Protocol. Q.22. What are ‘global commons’? Why is it said that international cooperation over the global commons is not easy? [CBSE Delhi 2016] Ans. Global commons are the resources which are not owned by any one country but rather owned by international community such as earth’s atmosphere, Antarctica, the ocean floor and the outer space. It is difficult to achieve consensus on common environmental agenda. History of outer space as global common shows that the management of these areas is influenced by North East inequalities. Like Earth’s atmosphere and the ocean floor, the crucial issue here is technology and development. The benefits of exploitative activities in outer space are far from being equal either for the present or the future.
 One example that can be cited is of the Philippines, where a vast network of groups and organisations campaigned against the Western Mining Corporation (WMC), an Australia-based multinational company. Q.5. Explain the role of Environment Movements to meet the challenge of Environmental Degradation. [CBSE Delhi 2016] Ans. Environmental movements meet the challenge of environmental degradation by: (i) Social movements such as the Chipko movement resist the degradation of their surrounding environment and become a popular movement. (ii) They ensure information campaigns in school, colleges and through popular media to highlight issues of environmental degradation. (iii) They pressurise governments to effectively combat climate change such as in Paris negotiations. (iv) These movements began ground campaigns such as cleaning beaches, etc. and thereby involve public participation.
 "
Mention India’s efforts to reduce its greenhouse gas emissions.,"India has exercised many efforts towards environment’s cleanliness and safety: 1. It has National Auto fuel Policy which mandates cleaner fuels for vehicles. 2. To improve energy efficiency, the Energy Conservation Act had been passed in 2001. 3. The Electricity Act of 2003 encourages the use of renewable energy. 4. It is importing natural gas and encouraging the adoption of clean coal technologies. 5. The government launched a National Mission on Biodiesel to produce biodiesel. 6. It has one of the largest renewable energy programmes in the world.","Q.6. Mention India’s efforts to reduce its greenhouse gas emissions. Ans. India has exercised many efforts towards environment’s cleanliness and safety: 1. It has National Auto fuel Policy which mandates cleaner fuels for vehicles. 2. To improve energy efficiency, the Energy Conservation Act had been passed in 2001. 3. The Electricity Act of 2003 encourages the use of renewable energy. 4. It is importing natural gas and encouraging the adoption of clean coal technologies. 5. The government launched a National Mission on Biodiesel to produce biodiesel. 6. It has one of the largest renewable energy programmes in the world. Q.7. “The Indian Government is already participating in global efforts through a number of programmes related to environmental issues.” Give any four examples to support the statement. [CBSE Delhi 2016] Or Explain India’s stand on environmental issues. [CBSE (AI) 2016] Ans. India has one of the lowest per person carbon output in the world. India is participating in global efforts related to environmental issues through: (i) India has committed itself to the obligations of the Kyoto Protocol and Paris Climate negotiations and has committed to reduce its carbon footprints. (ii) India has worked towards utilizing renewable energy through its National Solar mission, and other schemes. It is reducing its dependency on coal and other fossil fuels. (iii) India has made efforts to reduce greenhouse gas emissions, such as upgrading Euro IV emissions targets for motor vehicles, restrictions on polluting industries, etc. (iv) India has made efforts towards utilizing energy efficient technology and ensured safeguards in the form of energy efficient markings on appliances, etc. (v) India has invested in increasing its forest coverage area.
 "
“The Indian Government is already participating in global efforts through a number of programmes related to environmental issues.” Give any four examples to support the statement.  Or Explain India’s stand on environmental issues. [CBSE (AI) 2016],"India has one of the lowest per person carbon output in the world. India is participating in global efforts related to environmental issues through: (i) India has committed itself to the obligations of the Kyoto Protocol and Paris Climate negotiations and has committed to reduce its carbon footprints. (ii) India has worked towards utilizing renewable energy through its National Solar mission, and other schemes. It is reducing its dependency on coal and other fossil fuels. (iii) India has made efforts to reduce greenhouse gas emissions, such as upgrading Euro IV emissions targets for motor vehicles, restrictions on polluting industries, etc. (iv) India has made efforts towards utilizing energy efficient technology and ensured safeguards in the form of energy efficient markings on appliances, etc. (v) India has invested in increasing its forest coverage area.  ","Q.6. Mention India’s efforts to reduce its greenhouse gas emissions. Ans. India has exercised many efforts towards environment’s cleanliness and safety: 1. It has National Auto fuel Policy which mandates cleaner fuels for vehicles. 2. To improve energy efficiency, the Energy Conservation Act had been passed in 2001. 3. The Electricity Act of 2003 encourages the use of renewable energy. 4. It is importing natural gas and encouraging the adoption of clean coal technologies. 5. The government launched a National Mission on Biodiesel to produce biodiesel. 6. It has one of the largest renewable energy programmes in the world. Q.7. “The Indian Government is already participating in global efforts through a number of programmes related to environmental issues.” Give any four examples to support the statement. [CBSE Delhi 2016] Or Explain India’s stand on environmental issues. [CBSE (AI) 2016] Ans. India has one of the lowest per person carbon output in the world. India is participating in global efforts related to environmental issues through: (i) India has committed itself to the obligations of the Kyoto Protocol and Paris Climate negotiations and has committed to reduce its carbon footprints. (ii) India has worked towards utilizing renewable energy through its National Solar mission, and other schemes. It is reducing its dependency on coal and other fossil fuels. (iii) India has made efforts to reduce greenhouse gas emissions, such as upgrading Euro IV emissions targets for motor vehicles, restrictions on polluting industries, etc. (iv) India has made efforts towards utilizing energy efficient technology and ensured safeguards in the form of energy efficient markings on appliances, etc. (v) India has invested in increasing its forest coverage area.
 "
