question,answer,context
What is ‘Balance of Power’? How could a state achieve this? ,"‘Balance of Power’ is a component of traditional security policy—It is a widely accepted fact that countries of world never had same geography, population, financial resources, military, etc. So, balance of power is integral in states. When small countries look around them, they see that some countries are bigger and stronger. This is a clue to who might be a threat in the future. For instance, a neighbouring country may not say it is preparing for attack. There may be no obvious reason for attack. But the fact that this country is very powerful is a sign that some point in the future, it may choose to be aggressive. Governments are, therefore, very sensitive to the balance of power between their country and other countries. They do work hard to maintain a favourable balance of power with other countries, especially those close by, those with whom they have differences, or with those they have had conflicts in the past. A good part of maintaining a balance of power is to build up one’s military power, although economic and technological power are also important as they are the bases for military power.","Q.1. What is ‘Balance of Power’? How could a state achieve this? [NCERT] Ans. ‘Balance of Power’ is a component of traditional security policy—It is a widely accepted fact that countries of world never had same geography, population, financial resources, military, etc. So, balance of power is integral in states. When small countries look around them, they see that some countries are bigger and stronger. This is a clue to who might be a threat in the future. For instance, a neighbouring country may not say it is preparing for attack. There may be no obvious reason for attack. But the fact that this country is very powerful is a sign that some point in the future, it may choose to be aggressive. Governments are, therefore, very sensitive to the balance of power between their country and other countries. They do work hard to maintain a favourable balance of power with other countries, especially those close by, those with whom they have differences, or with those they have had conflicts in the past. A good part of maintaining a balance of power is to build up one’s military power, although economic and technological power are also important as they are the bases for military power. Q.2. What are the objectives of military alliances? Give an example of a functioning military, alliance with its specific objectives. [NCERT] Ans. An alliance is a coalition of states that coordinate their actions to deter or defend against military attack. Most alliances are formalised in written treaties and are based on a fairly clear identification of who constitutes the threat. Countries form alliances to increase the effective power relative to another country or alliance. NATO is a powerful organisation, which is still into existence. It aims at maintaining military security of American and West European countries that came under the leadership of USA. It also aims at maintaining military, cultural and economic dominance on western countries. Q.3. What are the four elements of security? Give an example of each. [CBSE Sample Paper] Ans. There are the four elements of security: 1. Deterrence: The condition where war is tried to be prevented, like nuclear power acted as a deterrent between both the super powers during the Cold War. 2. Military Power: To raise military power to limit or prevent the war and to face external power.
 3. Balance of power: Every country works hard to maintain a favourable balance of power, especially in military. For example, purchasing weapons from foreign countries for modernisation of military by India and Pakistan. 4. To form alliances: Some countries form an alliance to increase their military power and coordinate their actions to deter or defend against military attack done on any of the country. For example, ‘NATO’ and ‘Warsaw Pact’ were established by America and USSR respectively. Q.4. Explain the process of confidence building under traditional security conception. Ans. Traditional security also accepts confidence building as a means of avoiding violence. Confidence building is a process in which countries share their thoughts and information with their rivals. They tell each other about their military intentions and, up to a point, their military plans. This is a way to show that they are not planning a surprise attack. They also tell each other about the kind of forces they possess, and they may share information on where those forces are deployed. In short, confidence building is a process designed to ensure that rivals do not go to war through misunderstanding or misperception. Q.5. Explain the importance of cooperation in the field of ‘Traditional Security.’ [CBSE (AI) 2015] Ans. The importance of cooperation in the field of ‘Traditional Security’ is disarmament, arms control, and confidence building. Disarmament requires all states to give up certain kinds of weapons. For example, the 1972 Biological Weapons Convention (BWC) and 1992 Chemical Weapons Convention (CWC) banned the production and possession of these weapons. Arms control regulates the acquisition or development of weapons. The AntiBallistic Missile (ABM) Treaty 1972 tried to stop the United States and the Soviet Union from using ballistic missiles as a defensive shield to launch a nuclear attack. Confidence Building is accepted as a means of avoiding violence. It is a process in which countries share ideas and information with their rivals. Q.6. What is disarmament? Ans. Disarmament literally means ‘not keeping arms’. But no country can safeguard its boundaries without its military capability. So, disarmament refers to limit traditional weapons within a boundary by preventing nuclear weapons. The competition of weapons among countries have caused a global threat to international peace. The need of the hour is to end this competition and establish international peace. Q.7. What are the reasons behind increase in terrorism at international level?
 "
"What are the objectives of military alliances? Give an example of a functioning military, alliance with its specific objectives. ","An alliance is a coalition of states that coordinate their actions to deter or defend against military attack. Most alliances are formalised in written treaties and are based on a fairly clear identification of who constitutes the threat. Countries form alliances to increase the effective power relative to another country or alliance. NATO is a powerful organisation, which is still into existence. It aims at maintaining military security of American and West European countries that came under the leadership of USA. It also aims at maintaining military, cultural and economic dominance on western countries.","Q.1. What is ‘Balance of Power’? How could a state achieve this? [NCERT] Ans. ‘Balance of Power’ is a component of traditional security policy—It is a widely accepted fact that countries of world never had same geography, population, financial resources, military, etc. So, balance of power is integral in states. When small countries look around them, they see that some countries are bigger and stronger. This is a clue to who might be a threat in the future. For instance, a neighbouring country may not say it is preparing for attack. There may be no obvious reason for attack. But the fact that this country is very powerful is a sign that some point in the future, it may choose to be aggressive. Governments are, therefore, very sensitive to the balance of power between their country and other countries. They do work hard to maintain a favourable balance of power with other countries, especially those close by, those with whom they have differences, or with those they have had conflicts in the past. A good part of maintaining a balance of power is to build up one’s military power, although economic and technological power are also important as they are the bases for military power. Q.2. What are the objectives of military alliances? Give an example of a functioning military, alliance with its specific objectives. [NCERT] Ans. An alliance is a coalition of states that coordinate their actions to deter or defend against military attack. Most alliances are formalised in written treaties and are based on a fairly clear identification of who constitutes the threat. Countries form alliances to increase the effective power relative to another country or alliance. NATO is a powerful organisation, which is still into existence. It aims at maintaining military security of American and West European countries that came under the leadership of USA. It also aims at maintaining military, cultural and economic dominance on western countries. Q.3. What are the four elements of security? Give an example of each. [CBSE Sample Paper] Ans. There are the four elements of security: 1. Deterrence: The condition where war is tried to be prevented, like nuclear power acted as a deterrent between both the super powers during the Cold War. 2. Military Power: To raise military power to limit or prevent the war and to face external power.
 3. Balance of power: Every country works hard to maintain a favourable balance of power, especially in military. For example, purchasing weapons from foreign countries for modernisation of military by India and Pakistan. 4. To form alliances: Some countries form an alliance to increase their military power and coordinate their actions to deter or defend against military attack done on any of the country. For example, ‘NATO’ and ‘Warsaw Pact’ were established by America and USSR respectively. Q.4. Explain the process of confidence building under traditional security conception. Ans. Traditional security also accepts confidence building as a means of avoiding violence. Confidence building is a process in which countries share their thoughts and information with their rivals. They tell each other about their military intentions and, up to a point, their military plans. This is a way to show that they are not planning a surprise attack. They also tell each other about the kind of forces they possess, and they may share information on where those forces are deployed. In short, confidence building is a process designed to ensure that rivals do not go to war through misunderstanding or misperception. Q.5. Explain the importance of cooperation in the field of ‘Traditional Security.’ [CBSE (AI) 2015] Ans. The importance of cooperation in the field of ‘Traditional Security’ is disarmament, arms control, and confidence building. Disarmament requires all states to give up certain kinds of weapons. For example, the 1972 Biological Weapons Convention (BWC) and 1992 Chemical Weapons Convention (CWC) banned the production and possession of these weapons. Arms control regulates the acquisition or development of weapons. The AntiBallistic Missile (ABM) Treaty 1972 tried to stop the United States and the Soviet Union from using ballistic missiles as a defensive shield to launch a nuclear attack. Confidence Building is accepted as a means of avoiding violence. It is a process in which countries share ideas and information with their rivals. Q.6. What is disarmament? Ans. Disarmament literally means ‘not keeping arms’. But no country can safeguard its boundaries without its military capability. So, disarmament refers to limit traditional weapons within a boundary by preventing nuclear weapons. The competition of weapons among countries have caused a global threat to international peace. The need of the hour is to end this competition and establish international peace. Q.7. What are the reasons behind increase in terrorism at international level?
 "
What are the four elements of security? Give an example of each. ,"There are the four elements of security: 1. Deterrence: The condition where war is tried to be prevented, like nuclear power acted as a deterrent between both the super powers during the Cold War. 2. Military Power: To raise military power to limit or prevent the war and to face external power.  3. Balance of power: Every country works hard to maintain a favourable balance of power, especially in military. For example, purchasing weapons from foreign countries for modernisation of military by India and Pakistan. 4. To form alliances: Some countries form an alliance to increase their military power and coordinate their actions to deter or defend against military attack done on any of the country. For example, ‘NATO’ and ‘Warsaw Pact’ were established by America and USSR respectively.","Q.1. What is ‘Balance of Power’? How could a state achieve this? [NCERT] Ans. ‘Balance of Power’ is a component of traditional security policy—It is a widely accepted fact that countries of world never had same geography, population, financial resources, military, etc. So, balance of power is integral in states. When small countries look around them, they see that some countries are bigger and stronger. This is a clue to who might be a threat in the future. For instance, a neighbouring country may not say it is preparing for attack. There may be no obvious reason for attack. But the fact that this country is very powerful is a sign that some point in the future, it may choose to be aggressive. Governments are, therefore, very sensitive to the balance of power between their country and other countries. They do work hard to maintain a favourable balance of power with other countries, especially those close by, those with whom they have differences, or with those they have had conflicts in the past. A good part of maintaining a balance of power is to build up one’s military power, although economic and technological power are also important as they are the bases for military power. Q.2. What are the objectives of military alliances? Give an example of a functioning military, alliance with its specific objectives. [NCERT] Ans. An alliance is a coalition of states that coordinate their actions to deter or defend against military attack. Most alliances are formalised in written treaties and are based on a fairly clear identification of who constitutes the threat. Countries form alliances to increase the effective power relative to another country or alliance. NATO is a powerful organisation, which is still into existence. It aims at maintaining military security of American and West European countries that came under the leadership of USA. It also aims at maintaining military, cultural and economic dominance on western countries. Q.3. What are the four elements of security? Give an example of each. [CBSE Sample Paper] Ans. There are the four elements of security: 1. Deterrence: The condition where war is tried to be prevented, like nuclear power acted as a deterrent between both the super powers during the Cold War. 2. Military Power: To raise military power to limit or prevent the war and to face external power.
 3. Balance of power: Every country works hard to maintain a favourable balance of power, especially in military. For example, purchasing weapons from foreign countries for modernisation of military by India and Pakistan. 4. To form alliances: Some countries form an alliance to increase their military power and coordinate their actions to deter or defend against military attack done on any of the country. For example, ‘NATO’ and ‘Warsaw Pact’ were established by America and USSR respectively. Q.4. Explain the process of confidence building under traditional security conception. Ans. Traditional security also accepts confidence building as a means of avoiding violence. Confidence building is a process in which countries share their thoughts and information with their rivals. They tell each other about their military intentions and, up to a point, their military plans. This is a way to show that they are not planning a surprise attack. They also tell each other about the kind of forces they possess, and they may share information on where those forces are deployed. In short, confidence building is a process designed to ensure that rivals do not go to war through misunderstanding or misperception. Q.5. Explain the importance of cooperation in the field of ‘Traditional Security.’ [CBSE (AI) 2015] Ans. The importance of cooperation in the field of ‘Traditional Security’ is disarmament, arms control, and confidence building. Disarmament requires all states to give up certain kinds of weapons. For example, the 1972 Biological Weapons Convention (BWC) and 1992 Chemical Weapons Convention (CWC) banned the production and possession of these weapons. Arms control regulates the acquisition or development of weapons. The AntiBallistic Missile (ABM) Treaty 1972 tried to stop the United States and the Soviet Union from using ballistic missiles as a defensive shield to launch a nuclear attack. Confidence Building is accepted as a means of avoiding violence. It is a process in which countries share ideas and information with their rivals. Q.6. What is disarmament? Ans. Disarmament literally means ‘not keeping arms’. But no country can safeguard its boundaries without its military capability. So, disarmament refers to limit traditional weapons within a boundary by preventing nuclear weapons. The competition of weapons among countries have caused a global threat to international peace. The need of the hour is to end this competition and establish international peace. Q.7. What are the reasons behind increase in terrorism at international level?
 Explain balance of power as a component of traditional security policy. How could a state achieve this balance? [CBSE Delhi 2016] Ans. Traditional notion of external security– The greatest danger to a country is from military threats. The source of such a security threat emerges from another country which, through its military action, threatens the core values of sovereignity, independence and territorial integrity. Military action even endangers the life of ordinary residents of a country. In a war, it is highly unlikely that only soldiers would die or be hurt. In all the likelihood, men and women, who are ordinary citizens and soft targets are made victims in a war, to break their support for the war. Components of external security: 1. Avoidance of War: Governments may even make the choice of surrender when actually in a war, but this may not be promoted as a country’s defence policy. Security policy, is hence, concerned with preventing war, which is known as deterrence, and with limiting or ending war, which is called defence. 2. Balance of Power: Every country looks around to see potential bigger or stronger countries which can pose as a threat in the future. For instance, a neighbouring country might not declare that it is preparing for an attack. But the very fact, that the neighbour is powerful, points to the fact that in future the neighbour can be aggressive. Over here we can cite the example of South Asia. Even though India has never declared that it would attack upon its neighbours– Sri Lanka, Bangladesh, Nepal, etc., yet these countries are skeptical about India’s military designs because of its preparedness, size and potential. All governments, are therefore, quite sensitive to the ‘Balance of Power’ between their country and other states. They strive hard to maintain a favourable balance with the other states especially with those with whom they had differences or conflicts in the past. For maintaining balance of power, they build up military power along with economic and technological power as the latter two are the very basis of a country’s hand or military power. Q.4.Write a note on ‘ways of traditional security policy’. Ans. The most important of these are disarmament arms control and confidence building: 1. Disarmament: It requires all states to give up certain kinds of weapons. For example, the 1972 Biological weapons convention (BWC) and the 1992 Chemical weapons convention (CWC) banned the production and possession of these weapons. More than 155 states acceded to the BWC and 181 states acceded to the CWC. Both conventions include all the great powers. But the superpowers — the US and Soviet Union did not want to give up the third type of weapons of mass destruction, namely, nuclear weapons, so they pursued arms control.
 "
