question,answer,context
Elaborate 5 main functions of the UN Secretary-General.,"Following are the main functions of the UN Secretary-General: 1. To implement decisions taken by different components of Union. 2. To give report of all works done by Secretariat to General Assembly.  3. To organise conferences of Security council, economic/financial and social security. 4. Security council is informed if any unrest is seen in the world. 5. To resolve international issues peacefully. 6. To survey international issues and organise international seminars.","Q.1.What is the full form of WTO? When was it setup? How does it function? [CBSE Delhi 2016] Ans. The full form of WTO is World Trade Organisation. It was setup in 1995. WTO is a forum to negotiate and conduct talks on matters related to trade between various countries. WTO also has mechanism to solve trade disputes between countries. Q.2. Describe the main principles of the UN. Ans. Following are the main principles of the UN: (i) It accepts and believes in the principle of sovereignty of all nations and treating them equally. (ii) It is the responsibility of the UN members that they follow responsibilities mentioned in its charter. (iii) Issues and conflicts to be solved in peaceful ways rather than misusing powers by powerful nations, so that international peace and cooperation is maintained. (iv) All states should respect political independence and state sovereignty of other states. (v) The states should cooperate on all actions taken by the UN. (vi)The UN will not interfere in internal matters of any state. Q.3. What do you know about the UN General Assembly? Ans. The General Assembly is an integral part of the UN. All UN member states are involved in General Assembly. Each member state can nominate maximum five representatives but only one vote can be given by each member state. Usually, only one conference is held for the General Assembly in September-October. However, several conferences can be held if needed. The main functions of the UN General Assembly are as follows: 1. To think and propose effective solutions to the problems related to peace, cooperation, safety and human rights all over the world. 2. Make Security Council aware of serious problems which could threaten International Peace. 3. To pass the UN budget. 4. To elect members of other UN components.
 5. To elect the UN Secretary General on the approach of 10 non-permanent members of the UN security council, 54 members of economic and social council. 6. To help new countries join as UN members and to take decisions if anyone wishes to terminate membership. Q.4. How many member states of the UN have veto powers and why? [CBSE (AI) 2011] Ans. 5 permanent member states of the UN – America, Britain, China, France and Russia have veto powers. These powers are given to them because their agreement is necessary in the international affairs to be discussed in the UN or the UN Security Council. If any one disagrees or opposes the proposed solution, then the proposal ends up. Q.5. What is International Monetary fund? Ans. Some organisations had played a very important role after the Cold War, especially IMF. The International Monetary fund (IMF) is an international organisation that oversees those financial institutions and regulations that act at the international level. The IMF has 189 member countries but they do not enjoy an equal status. The top ten countries have more than 52% of the votes. They are G-8 members. (The US, Japan, Germany, France, the UK, Italy, Canada and Russia), China and Saudi Arabia. The US alone has 17.4% voting rights. Q.6. What is Human Rights Watch? Describe its main contribution to the field of Human Rights. [CBSE (AI) 2016] Ans. Human Rights watch is an international NGO, involved in research and advocacy on human rights. Its contributions: (i) It draws the global media’s attention to human rights abuses. (ii) It helped in building international coalitions. (iii) It made efforts to stop the use of child soldiers. (iv) It established the International Criminal court. (any three points) Q.7. Elaborate 5 main functions of the UN Secretary-General. Ans. Following are the main functions of the UN Secretary-General: 1. To implement decisions taken by different components of Union. 2. To give report of all works done by Secretariat to General Assembly.
 3. To organise conferences of Security council, economic/financial and social security. 4. Security council is informed if any unrest is seen in the world. 5. To resolve international issues peacefully. 6. To survey international issues and organise international seminars. Q.8. What is Amnesty International? State its main functions. [CBSE Delhi 2016] Ans. Amnesty International is an NGO that campaigns for the protection of Human Rights.Function: (i) It prepares and publishes reports on human rights. (ii) It mainly focuses on the misconduct of the government authorities in its reports. (iii) They favour and play a major role in research, related to human rights. Q.9. Critically evaluate the difficulties involved in implementing the suggested reforms to reconstruct the UN. [NCERT] Ans. Following are the difficulties involved in implementing the suggested reforms to reconstruct the UN: 1. There should be 15 permanent members instead of 5 permanent members and veto powers should be abolished. But the present permanent members do not let the UN do so. 2. All members should have the right to vote and decisions in General Assembly should be taken on the basis of majority. But powerful nations oppose this. 3. Tenure of Secretary-General should be increased from 5 to 7 years in addition to increase in his/her rights. Its nomination should be done by non-political, impartial committee so that he/she does not have to depend upon permanent countries. On the other hand, permanent members are not in favour of their alternative measure.Domination of permanent member states can be seen in the UN and they do not like any interference in their rights and powers. They have interest in the UN only because of ‘veto powers’. Apart from this, the US interfere in the decisions of the UN. It even plays a role in the nomination of the GeneralSecretariat. Reforms in the UN organisation is difficult due to these problems. Q.10. What is World Bank? Ans. The World Bank was created immediately after the second world war in 1945. Its activities are focused on the developing countries. It works for human development (education, health), agriculture and rural development (irrigation, rural services, establishing and enforcing regulations), infrastructure (roads, urban regeneration, electricity) and governance (anti-corruption, development of legal institutions). It
 5. The United Nations High Commissioner for Refugees (UNHCR) 6. The United Nations International Children’s Emergency Fund (UNICEF) 7. The United Nations Educational, Scientific and Cultural Organisation (UNESCO). Q.2. Describe main components/organs of the UN. Ans. The United Nations Organisation was founded in order to stop the conflicts between states, to prevent the world from being faced the negative effects of the second world war, to promote peace, brotherhood and human development. 51 members states were included in it and have increased upto 193 now. Following are its main organs according to the UN Charter: 1. General Assembly: All the UN member states are involved in the General Assembly. Each member state can nominate a maximum of 5 representatives but only one vote can be given by each member state. Usually, only one conference is held for the General Assembly. However, several conferences can be held if the need be. Its main functions are to think and propose effective solutions to problems related to peace and safety, to pass the UN budget and to elect members of other organs of the UN. 2. Security Council: It is the most important organ of the UN. It has America, Britain, China, France and Russia as five permanent members and 10 non-permanent members. The non-permanent members serve only for two years at a time and are elected regionally by the General Assembly. Its main functions are to establish peace in the world, to resolve conflicts and propose solutions and use its powers against any country (if the need be). It elects judges of the International court of Justice with the help of the General Assembly. 3. Economic and Social Council: This integral organ of the UN has 54 members. These members are elected by the General Assembly. Member states have tenure of 3 years. But 1/3 members are chosen every year. The country can again be chosen as a member of economic and social council by completing its tenure of 3 years. To take measures related to economic, social, cultural, health and cure and to organise international summits are its functions. 4. Trusteeship Council: The countries which are kept under control and care of other UN member countries are taken care by the council. Evolution and progress of these countries is the responsibility of this council. Since, all the countries have become capable enough to maintain their system, no significance of trusteeship council can be observed. 5. International Court of Justice: There are a total of 15 judges. The General Assembly and the Security Council choose the judges. Tenure of judges is 5 years. Members and non-members of the UN can take their cases to the International Court of Justice. Court resolves all the matters presented to it. International Court of Justice is main judicial unit of the UN. It is situated at Hague, Holland.
 6. Secretariat: This is the UN head office, headed by the Secretary General, who is appointed by the General Assembly on the recommendation of the Security Council for a five-year renewable term. All permanent member countries of the UN should agree. Its role is to control and supervise the different organs of the UN spread all over the world. The UN General-Secretary takes part in conferences of the General Assembly, Security Council, Economic and Social Council and the Trusteeship Council. Its role is to maintain a record of all the actions. Q.3. Describe any six criteria for the new membership of Security Council as suggested after 1997. [CBSE Delhi 2015] Ans. ix criteria for the new membership of Security Council are as follows: (i) A major economic power. (ii) A major military power. (iii) A substantial contributor to the UN budget. (iv) A big nation in terms of its population. (v) A nation that respects democracy and Human Rights. (vi) A country that would make the council more representative of the world’s diversity in terms of geography, economic systems and culture. Q.4. Highlight the role played by India in the UN. [CBSE Sample Paper] Ans. India has been a member of the UN from its day of foundation, 24th October, 1945. It has shown deep respect towards the principles mentioned in the UN charter and considers the UN an integral organisation for world peace. Following are the roles played by India in the UN: 1. Considering the UN universal: India wants that all countries of the world become a part of the UN. India played a major role in making Bangladesh, Ireland, Hungary and Sri Lanka, a member of the UN. China and Pakistan always opposed India but India still favoured them. 2. Disarmament: All the countries have been demanding for disarmament after the second world war. India is one of them. India has been constantly supporting eliminating the use of nuclear weapons. The Limited Test Ban Treaty (LTBT) signed by the US, UK and USSR was welcomed by India. Foreign Minister of India was chosen as a representative in the UN’s disarmament summit. 3. Supporting the revolt against colonialism and apartheid: India has always revolted against colonialism, apartheid and racism. It is due to this reason that in 1961,
 6. Secretariat: This is the UN head office, headed by the Secretary General, who is appointed by the General Assembly on the recommendation of the Security Council for a five-year renewable term. All permanent member countries of the UN should agree. Its role is to control and supervise the different organs of the UN spread all over the world. The UN General-Secretary takes part in conferences of the General Assembly, Security Council, Economic and Social Council and the Trusteeship Council. Its role is to maintain a record of all the actions. Q.3. Describe any six criteria for the new membership of Security Council as suggested after 1997. [CBSE Delhi 2015] Ans. ix criteria for the new membership of Security Council are as follows: (i) A major economic power. (ii) A major military power. (iii) A substantial contributor to the UN budget. (iv) A big nation in terms of its population. (v) A nation that respects democracy and Human Rights. (vi) A country that would make the council more representative of the world’s diversity in terms of geography, economic systems and culture. Q.4. Highlight the role played by India in the UN. [CBSE Sample Paper] Ans. India has been a member of the UN from its day of foundation, 24th October, 1945. It has shown deep respect towards the principles mentioned in the UN charter and considers the UN an integral organisation for world peace. Following are the roles played by India in the UN: 1. Considering the UN universal: India wants that all countries of the world become a part of the UN. India played a major role in making Bangladesh, Ireland, Hungary and Sri Lanka, a member of the UN. China and Pakistan always opposed India but India still favoured them. 2. Disarmament: All the countries have been demanding for disarmament after the second world war. India is one of them. India has been constantly supporting eliminating the use of nuclear weapons. The Limited Test Ban Treaty (LTBT) signed by the US, UK and USSR was welcomed by India. Foreign Minister of India was chosen as a representative in the UN’s disarmament summit. 3. Supporting the revolt against colonialism and apartheid: India has always revolted against colonialism, apartheid and racism. It is due to this reason that in 1961,
 "
What is Amnesty International? State its main functions. ,"Amnesty International is an NGO that campaigns for the protection of Human Rights.Function: (i) It prepares and publishes reports on human rights. (ii) It mainly focuses on the misconduct of the government authorities in its reports. (iii) They favour and play a major role in research, related to human rights.","3. To organise conferences of Security council, economic/financial and social security. 4. Security council is informed if any unrest is seen in the world. 5. To resolve international issues peacefully. 6. To survey international issues and organise international seminars. Q.8. What is Amnesty International? State its main functions. [CBSE Delhi 2016] Ans. Amnesty International is an NGO that campaigns for the protection of Human Rights.Function: (i) It prepares and publishes reports on human rights. (ii) It mainly focuses on the misconduct of the government authorities in its reports. (iii) They favour and play a major role in research, related to human rights. Q.9. Critically evaluate the difficulties involved in implementing the suggested reforms to reconstruct the UN. [NCERT] Ans. Following are the difficulties involved in implementing the suggested reforms to reconstruct the UN: 1. There should be 15 permanent members instead of 5 permanent members and veto powers should be abolished. But the present permanent members do not let the UN do so. 2. All members should have the right to vote and decisions in General Assembly should be taken on the basis of majority. But powerful nations oppose this. 3. Tenure of Secretary-General should be increased from 5 to 7 years in addition to increase in his/her rights. Its nomination should be done by non-political, impartial committee so that he/she does not have to depend upon permanent countries. On the other hand, permanent members are not in favour of their alternative measure.Domination of permanent member states can be seen in the UN and they do not like any interference in their rights and powers. They have interest in the UN only because of ‘veto powers’. Apart from this, the US interfere in the decisions of the UN. It even plays a role in the nomination of the GeneralSecretariat. Reforms in the UN organisation is difficult due to these problems. Q.10. What is World Bank? Ans. The World Bank was created immediately after the second world war in 1945. Its activities are focused on the developing countries. It works for human development (education, health), agriculture and rural development (irrigation, rural services, establishing and enforcing regulations), infrastructure (roads, urban regeneration, electricity) and governance (anti-corruption, development of legal institutions). It
 "
Critically evaluate the difficulties involved in implementing the suggested reforms to reconstruct the UN. ,"Following are the difficulties involved in implementing the suggested reforms to reconstruct the UN: 1. There should be 15 permanent members instead of 5 permanent members and veto powers should be abolished. But the present permanent members do not let the UN do so. 2. All members should have the right to vote and decisions in General Assembly should be taken on the basis of majority. But powerful nations oppose this. 3. Tenure of Secretary-General should be increased from 5 to 7 years in addition to increase in his/her rights. Its nomination should be done by non-political, impartial committee so that he/she does not have to depend upon permanent countries. On the other hand, permanent members are not in favour of their alternative measure.Domination of permanent member states can be seen in the UN and they do not like any interference in their rights and powers. They have interest in the UN only because of ‘veto powers’. Apart from this, the US interfere in the decisions of the UN. It even plays a role in the nomination of the GeneralSecretariat. Reforms in the UN organisation is difficult due to these problems.","Q.14. Describe the composition of UN Security Council. What is the major difference in the privileges given to its permanent and non-permanent members? [CBSE (AI) 2016] Ans. UN Security Council is an important organ of United Nations. It has fifteen members – five permanent and ten elected by the General Assembly for two year terms. Difference in the privileges between permanent and non-permanent members: (i) The main privileges of the permanent members are permanency and the veto power, which can neglect any resolution of the Security Council. (ii) The non-permanent members serve for only two years at a time. A country cannot be re-elected immediately after completing their term. They do not have Veto power. (iii) The permanent members were not chosen through an election while nonpermanent members are elected by general assembly. Q.15. Though the UN has failed in preventing wars and related miseries, nations prefer its continuation. What makes the UN an indispensable organisation? [NCERT] Ans. Though the UN has failed in preventing wars and related miseries, nations prefer its continuation. Following are the reasons behind this thinking: 1. UN has failed in preventing small scale war. But the greatest success of UN lies in preventing the whole world from third world war which can destroy the human kind. 2. UN is the only international organisation in which 193 member countries are included. It provides a platform to discuss on issues like international peace, security, economy, social aspects with open minds. 3. It is the only platform where mutual differences are settled not by war but peacefully by filing a complaint against each other in UN security council. It has prohibited the use of chemicals and nuclear weapons.
 4. UN provides medical aid in emergency and loan from World Bank and IMF to backward countries. 5. Works on certain areas like – education, epidemic, health and terrorism which cannot be done without international cooperation. 6. Unipolar system is there in the world and US hegemony is seen in the world. UN can control US. It can hold a discussion between US and other countries on certain issues. UN, alongwith its member nations can react to US hegemony and actions. Q.16. ‘Reforming the UN means restructuring of the security council.’ Do you agree with this statement? Give arguments for or against this position. [NCERT] Ans. Security Council is an integral part of the United Nations. It acts as UN’s executive head. There are five permanent members and ten non-permanent members. America, Britain, China, France and Russia are its permanent members. The non-permanent members serve for only two years at a time. There are two ways to vote to take decision in Security council. In Procedural means, vote of atleast 9 members out of 15 members should be in favour of the proposal. While taking decisions related to military, finance or other important issues, all five permanent nations should agree in addition to the votes in favour of the proposal. In other words, the proposal does not pass if any one of the permanent member is not in its favour, irrespective of the number of votes came in its favour. This process of election in the security council is known as ‘veto’ power of the permanent-members of the UN. The Security Council is a powerful organistion of the UN. It can give directions to other countries to resolve conflicts between nations or can solve them by intervention, maintaining peace, law, order and security by resolving conflicts as it is the responsibility of the Security Council. If these peaceful ways do not work, then the Security Council adopts coercive method before war. It can even order the country found guilty to break trade-commerce-financial and diplomatic relations. If coercive method does not work, then military actions against the country found guilty, can also be taken. Reforms in structure of the Security Council can pave way for the UN’s improvement as the Security Council is the backbone of the UN. The structure of the Security Council is such that it plays role of a judge in all matters, so UN cannot be improved without structural reforms in the Security Council. Q.17. Although UN has failed to act as effective checks on the hegemony of US, nations prefer its continuation. Suggest any three suitable arguments to justify the relevance of UN in the post-cold war era. [CBSE Sample Paper 2016] Ans. Relevance of UN in the post-cold war period: (i) In the unipolar world, the UN can and has served to bring US and rest of the world into discussion on various issues.
 4. UN provides medical aid in emergency and loan from World Bank and IMF to backward countries. 5. Works on certain areas like – education, epidemic, health and terrorism which cannot be done without international cooperation. 6. Unipolar system is there in the world and US hegemony is seen in the world. UN can control US. It can hold a discussion between US and other countries on certain issues. UN, alongwith its member nations can react to US hegemony and actions. Q.16. ‘Reforming the UN means restructuring of the security council.’ Do you agree with this statement? Give arguments for or against this position. [NCERT] Ans. Security Council is an integral part of the United Nations. It acts as UN’s executive head. There are five permanent members and ten non-permanent members. America, Britain, China, France and Russia are its permanent members. The non-permanent members serve for only two years at a time. There are two ways to vote to take decision in Security council. In Procedural means, vote of atleast 9 members out of 15 members should be in favour of the proposal. While taking decisions related to military, finance or other important issues, all five permanent nations should agree in addition to the votes in favour of the proposal. In other words, the proposal does not pass if any one of the permanent member is not in its favour, irrespective of the number of votes came in its favour. This process of election in the security council is known as ‘veto’ power of the permanent-members of the UN. The Security Council is a powerful organistion of the UN. It can give directions to other countries to resolve conflicts between nations or can solve them by intervention, maintaining peace, law, order and security by resolving conflicts as it is the responsibility of the Security Council. If these peaceful ways do not work, then the Security Council adopts coercive method before war. It can even order the country found guilty to break trade-commerce-financial and diplomatic relations. If coercive method does not work, then military actions against the country found guilty, can also be taken. Reforms in structure of the Security Council can pave way for the UN’s improvement as the Security Council is the backbone of the UN. The structure of the Security Council is such that it plays role of a judge in all matters, so UN cannot be improved without structural reforms in the Security Council. Q.17. Although UN has failed to act as effective checks on the hegemony of US, nations prefer its continuation. Suggest any three suitable arguments to justify the relevance of UN in the post-cold war era. [CBSE Sample Paper 2016] Ans. Relevance of UN in the post-cold war period: (i) In the unipolar world, the UN can and has served to bring US and rest of the world into discussion on various issues.
 "
