question,answer,context
List challenges to democracy in Pakistan. ,"There are several challenges to democracy in Pakistan. The social dominance of the military, clergy and landowning aristocracy has led to the frequent overthrow of elected governments and the establishment of military government. Pakistan’s conflict with India has made the pro-military groups more powerful. These groups have often said that political parties and democracy in Pakistan are flawed, that Pakistan’s security would be harmed by selfish-minded parties and chaotic democracy, and that the army’s stay in power is justified while democracy has not been completely successful in Pakistan, there has been a strong pro-democracy sentiment in the country, Pakistan has a courageous and relatively free press and a strong human rights movement.","Q.1. Describe any two major issues between India and Pakistan which led to war of 1971. [CBSE Delhi 2013] Ans. War of 1971 held because of two main reasons: (i) Refugee problem in 1971: A disintegrated Pakistan came in elections of 1970. Parties of Zulfikar Ali Bhutto and Sheikh Mujibur succeeded in Western and Eastern Pakistan respectively. Bengali population of eastern Pakistan voted heavily against Western Pakistan. Rulers of Western Pakistan considered citizens of eastern Pakistan as ‘another level’ citizens. Pakistan didn’t consider decision of democracy taken by eastern Pakistan valid. They also refused to convene the assembly of Sheikh Mujibur Rahman. Sheikh Mujibur was arrested and Pakistani army tried to suppress the mass movement of the Bengali people. This led to a large scale migration into India, creating a huge refugee problem in India. The government of India supported people of east Pakistan. Consequently, India had a war with Pakistan. (ii) To support Bangladesh for its independence: In 1971, people of eastern Pakistan resented the domination of Western Pakistan and the imposition of an Urdu language. Thousands were killed by the Pakistani army which led to huge scale migration into India. India too gave them shelter. In addition to this, India support Bangladesh in its struggle for independence. Pakistan strongly opposed this step of India and attacked on its airports on 3 December, 1971. Indian army too attacked Pakistan. Pakistan lost the war which resulted in the transformation of eastern Pakistan into newly independent country ‘Bangladesh’. Q.2. ‘Pakistan has witnessed both civilian and democratic system’. Explain. Ans. Pakistan has witnessed civilian system many times despite of citizens aspiration for democracy. In last 65 years, almost 29-30 years were ruled by civilians in Pakistan from 1947 to 2012. General Ayub Khan, General Yahya, General Zia-ul-Haq and General Pervez Musharraf were among the leaders of civil-rule. The first military rule inPakistan was established under the leadership of General Ayub Khan and was succeeded in announcing constitution ruler of Pakistan through the drama of elections. But he couldn’t befool public and public outrage increased. Unstability and dissatisfaction against him was increasing in Pakistan army. General Yahya took advantage, overthrew the government and himself became the dictator. Separation of eastern part of Pakistan and Pakistan’s defeat from India banished Yahya Khan from his power and an elected government under the leadership of Zulfikar Ali Bhutto came into power. Within the period of 7 years, Bhutto government was removed by General Zia-ul-Haq by a military revolution and was hanged after sometime.Dissatisfaction
 towards military rule of General Zia-ul-Haq and democratic government under the leadership of Benezir Bhutto, daughter of Bhutto was established in Pakistan. According to the structure of political democratic structure of Pakistan from 1988 to 1999, Benezir Bhutto’s government centered around Pakistan People’s Party and Muslim league of Nawaz Sharif. In starting of 1999, military under leadership of General Parvez Musharraf overthrew government of Nawaz Sharif, Prime Minister of Pakistan and was dismissed from Pakistan. General Musharraf got himself elected as the President. Announcement of emergency in Pakistan was done in the last months of 2006. Elections were planned on 8 January 2008 but were postponed due to death of Benezir Bhutto during campaigning. Recently, ordinary elections took place in Pakistan, where Pakistan Muslim League (PML) was formed and Nawaz Sharif was elected as Prime Minister. Q.3. Even after sharing a same history, why roots of democracy could not be strengthened in Pakistan as they are in India? [CBSE (AI) 2011] Ans. The reasons behind unstable democracy in Pakistan are as follows: (i) The social dominance of the military, clergy and landowning aristocracy has led to the frequent overthrow of elected governments and the establishment of military government. Pakistan’s conflict with India has made the pro-military groups more powerful. These groups have often said that political parties and democracy inPakistan are flawed, that Pakistan’s security would be harmed by selfish-minded parties and chaotic democracy, and that army’s stay in power, is therefore, justified. While democracy has not been fully successful in Pakistan, there has been a strong prodemocracy sentiment in the country. (ii) Pakistan has a courageous and relatively free press and a strong human rights movement. The lack of genuine international support for its democratic rule in Pakistan has further encouraged the military to continue its dominance. The United States and other western countries have encouraged the military’s authoritarian rule in the past, for their own reasons. Given the fact that the threat of what they call as ‘Global Islamic Terrorism’ and the apprehension that Pakistan’s nuclear arsenal might fall into the hands of these terrorist groups, the military regime in Pakistan has been seen as the protector of Western interests in West Asia and South Asia. Q.4. Explain any three factors that are responsible for the failure of building a stable democratic rule in Pakistan. Ans. The factors responsible for the failure of building a stable democratic rule in Pakistanare as follows: 1. The social dominance of the military, clergy and landowning aristocracy has led to frequent overthrow of elected governments and establishment of military governments.
 towards military rule of General Zia-ul-Haq and democratic government under the leadership of Benezir Bhutto, daughter of Bhutto was established in Pakistan. According to the structure of political democratic structure of Pakistan from 1988 to 1999, Benezir Bhutto’s government centered around Pakistan People’s Party and Muslim league of Nawaz Sharif. In starting of 1999, military under leadership of General Parvez Musharraf overthrew government of Nawaz Sharif, Prime Minister of Pakistan and was dismissed from Pakistan. General Musharraf got himself elected as the President. Announcement of emergency in Pakistan was done in the last months of 2006. Elections were planned on 8 January 2008 but were postponed due to death of Benezir Bhutto during campaigning. Recently, ordinary elections took place in Pakistan, where Pakistan Muslim League (PML) was formed and Nawaz Sharif was elected as Prime Minister. Q.3. Even after sharing a same history, why roots of democracy could not be strengthened in Pakistan as they are in India? [CBSE (AI) 2011] Ans. The reasons behind unstable democracy in Pakistan are as follows: (i) The social dominance of the military, clergy and landowning aristocracy has led to the frequent overthrow of elected governments and the establishment of military government. Pakistan’s conflict with India has made the pro-military groups more powerful. These groups have often said that political parties and democracy inPakistan are flawed, that Pakistan’s security would be harmed by selfish-minded parties and chaotic democracy, and that army’s stay in power, is therefore, justified. While democracy has not been fully successful in Pakistan, there has been a strong prodemocracy sentiment in the country. (ii) Pakistan has a courageous and relatively free press and a strong human rights movement. The lack of genuine international support for its democratic rule in Pakistan has further encouraged the military to continue its dominance. The United States and other western countries have encouraged the military’s authoritarian rule in the past, for their own reasons. Given the fact that the threat of what they call as ‘Global Islamic Terrorism’ and the apprehension that Pakistan’s nuclear arsenal might fall into the hands of these terrorist groups, the military regime in Pakistan has been seen as the protector of Western interests in West Asia and South Asia. Q.4. Explain any three factors that are responsible for the failure of building a stable democratic rule in Pakistan. Ans. The factors responsible for the failure of building a stable democratic rule in Pakistanare as follows: 1. The social dominance of the military, clergy and landowning aristocracy has led to frequent overthrow of elected governments and establishment of military governments.
 2. Pakistan’s conflict with India also made the pro military groups more powerful. These groups have often said that political parties and democracy in Pakistan are flawed; that Pakistan’s security would be harmed by selfish minded parties and chaotic democracy and that army’s stay in power is, therefore, justified. 3. The lack of genuine international support for democratic rule in Pakistan has further encouraged military to continue its dominance. Q.5. Describe India-Nepal relationship. Ans. India has special friendly relationship with world’s only Hindu country, Nepal. Citizens of Nepal enjoy special benefits in trade and commerce in India. Large number of natives of Nepal have shown bravery in Indian army. India has assisted Nepal in its many plans and projects. India has played a major role in getting Nepal independence from autocracy of Rana dynasty. An agreement of peace, friendship and trade was signed by both the countries on 31 July, 1950. Special facilities have been given to India by Nepal. Some disputes occurred when India supported democratic movement against Mahendra, King of Nepal. Nepal’s trust was re-established when Indira Gandhi, Prime Minister of India visited Nepal. Nepal provided port facility to Kolkata after signing TTT, which accelerated normalisation of Indo-Nepal relationship. The tensions of 1989 were resolved due to re-establishment of multilateral system. TTT was revised by both the countries in 1991 and 2002. United River Development Project agreement was signed in 1996 by both the countries and agreed on cooperation with the help of SAARC. Reestablishment of democracy in Nepal strengthen Indo-Nepal relationship. Both are engaged in identifying regions of cooperation and collective benefits. Stability to IndoNepal relationship and emergence of Free Trade Area in South Asia will be accelerated because of the Maoists and seven teams agreement in 2007. Indian Prime Minister visited Nepal in 2015 and proposed to resolve matters peacefully. He promised to assist Nepal to resolve destruction occurred due to earthquake in Nepal. At present, IndoNepal relations are peaceful and India tries its level best to help Nepal. Q.6. Give a brief description of relationship of India and the Maldives. Ans. India’s ties with the Maldives remain warm and cordial. Islamic region, the Maldives is deeply associated with India. Port of Indian navy, soldiers was established at GAN which remained till 1975 during British rule in addition to India’s responsibility of security of Maldives. The Maldives participated in establishing SAARC in the summit of foreign ministers of seven states of South Asia – Bangladesh, Bhutan, India, The Maldives, Nepal, Pakistan and Sri Lanka organised at New Delhi, Capital of India in 1983. In November 1988, some handful of terrorists tried to overthrow Abdul Gayum government with foreign help. On the request of President of the Maldives, India sent its army and completely defeated conspirators. Indian army stayed at the Maldives for a year until the government of the Maldives got stable and returned India on 3 November, 1989. The Maldives successfully organised the 5th SAARC summit in its capital, Male’ in 1990. India is Supporting the Maldives in its plans. It has given Indira Gandhi
 Q.1. List challenges to democracy in Pakistan. [NCERT] Ans. There are several challenges to democracy in Pakistan. The social dominance of the military, clergy and landowning aristocracy has led to the frequent overthrow of elected governments and the establishment of military government. Pakistan’s conflict with India has made the pro-military groups more powerful. These groups have often said that political parties and democracy in Pakistan are flawed, that Pakistan’s security would be harmed by selfish-minded parties and chaotic democracy, and that the army’s stay in power is justified while democracy has not been completely successful in Pakistan, there has been a strong pro-democracy sentiment in the country, Pakistan has a courageous and relatively free press and a strong human rights movement. Q.2. Write any four reasons for ethnic conflicts in Sri Lanka. [CBSE (AI) 2014] Ans. Following were the reasons for ethnic conflicts in Sri Lanka. 1. Demand of separate country for the Tamils of Sri Lanka. 2. Pressure of majority of Sinhala community on Sri Lankan Politics. 3. Majority of Sinhala community was hostile to a large number of Tamils, who had migrated from India to Sri Lanka and settled there. 4. Neglect of Tamil by Sinhalas and believing that Sri Lanka belongs to the Sinhala people only. Q.3. Who play a major role in ethnic conflicts in Sri Lanka? [NCERT] Ans. Indian natives Tamils play a major role in ethnic conflicts in Sri Lanka. Before independence, British took Tamils as workers to Sri Lanka, who settled there. The settlement of Tamils in Sri Lanka continued even after its independence too. There was a domination of Sinhala community in Sri Lanka. They thought that Sri Lanka shouldnot give ‘concessions’ to the Tamils because Sri Lanka belongs to the Sinhala people only. The neglect of Tamil concerns led to militant Tamil nationalism. From 1983 onwards, the militant organisation, the Liberation Tigers of Tamil Eelam (LTTE) has been fighting an armed struggle with the army of Sri Lanka and demanding ‘Tamil Eelam’ or a separate country for the Tamils of Sri Lanka. The LTTE controls the northeastern parts of Sri Lanka.
 "
Write any four reasons for ethnic conflicts in Sri Lanka. [CBSE (AI) 2014],"Following were the reasons for ethnic conflicts in Sri Lanka. 1. Demand of separate country for the Tamils of Sri Lanka. 2. Pressure of majority of Sinhala community on Sri Lankan Politics. 3. Majority of Sinhala community was hostile to a large number of Tamils, who had migrated from India to Sri Lanka and settled there. 4. Neglect of Tamil by Sinhalas and believing that Sri Lanka belongs to the Sinhala people only.","Q.1. List challenges to democracy in Pakistan. [NCERT] Ans. There are several challenges to democracy in Pakistan. The social dominance of the military, clergy and landowning aristocracy has led to the frequent overthrow of elected governments and the establishment of military government. Pakistan’s conflict with India has made the pro-military groups more powerful. These groups have often said that political parties and democracy in Pakistan are flawed, that Pakistan’s security would be harmed by selfish-minded parties and chaotic democracy, and that the army’s stay in power is justified while democracy has not been completely successful in Pakistan, there has been a strong pro-democracy sentiment in the country, Pakistan has a courageous and relatively free press and a strong human rights movement. Q.2. Write any four reasons for ethnic conflicts in Sri Lanka. [CBSE (AI) 2014] Ans. Following were the reasons for ethnic conflicts in Sri Lanka. 1. Demand of separate country for the Tamils of Sri Lanka. 2. Pressure of majority of Sinhala community on Sri Lankan Politics. 3. Majority of Sinhala community was hostile to a large number of Tamils, who had migrated from India to Sri Lanka and settled there. 4. Neglect of Tamil by Sinhalas and believing that Sri Lanka belongs to the Sinhala people only. Q.3. Who play a major role in ethnic conflicts in Sri Lanka? [NCERT] Ans. Indian natives Tamils play a major role in ethnic conflicts in Sri Lanka. Before independence, British took Tamils as workers to Sri Lanka, who settled there. The settlement of Tamils in Sri Lanka continued even after its independence too. There was a domination of Sinhala community in Sri Lanka. They thought that Sri Lanka shouldnot give ‘concessions’ to the Tamils because Sri Lanka belongs to the Sinhala people only. The neglect of Tamil concerns led to militant Tamil nationalism. From 1983 onwards, the militant organisation, the Liberation Tigers of Tamil Eelam (LTTE) has been fighting an armed struggle with the army of Sri Lanka and demanding ‘Tamil Eelam’ or a separate country for the Tamils of Sri Lanka. The LTTE controls the northeastern parts of Sri Lanka.
 "
