question,answer,context
Amoeba reproduces by which process ? Explain in brief.,"Amoeba reproduces by asexual reproduction, binary fission. It begins the process of reproduction by the division of its nucleus in two nuclei. This is followed by division of its body into two, where each part receives a nucleus. Finally two amoebae are produced from one parent amoeba.","Amoeba reproduces by budding.
 "
What is Metamorphosis ? ,The transformation of the larva into an adult through drastic changes is called metamorphosis.,"features that are present in the adult are not found in these young ones. Then what happens to the tadpoles or caterpillars thereafter? You must have seen a beautiful moth emerging out of the cocoon. In the case of tadpoles, they transform into adults capable of jumping and swimming. The transformation of the larva into an adult through drastic changes is called metamorphosis. What about the changes that we observe in our body as we grow? Do you think we too undergo metamorphosis? In human beings, body parts similar to those present in the adults are present from the time of birth.
 "
Write difference between viviparous and oviparous animals.,"Difference between viviparous and oviparous : Viviparous The animals that give birth to young ones are called viviparous animals. e.g., Human beings, Cats, dogs. Oviparous The animals that lay eggs are called oviparous animals. e.g., Frogs, fishes.","place inside the egg shell during this period? After the chick is completely developed it bursts open the egg shell. In animals which undergo external fertilisation, development of the embryo takes place outside the female body. The embryos continue to grow within their egg coverings. After the embryos develop, the eggs hatch. You must have seen numerous tadpoles swimming in ponds and streams. Viviparous and Oviparous Animals We have learnt that some animals give birth to young ones while some animals lay eggs which later develop into young ones. The animals which give birth to young ones are called viviparous animals. Those animals which lay eggs are called oviparous animals. The following activity will help you understand better and differentiate between viviparous and oviparous animals.
 "
How is egg formed in the hen ?,"After fertilization, the zygote divides repeatedly and travels down the oviduct. As it travels down, many protective layers are formed around it. The hard shell is formed","Development of Embryo Fertilisation results in the formation of zygote which begins to develop into an embryo [Fig. 9.8(a)]. The zygote divides repeatedly to give rise to a ball of cells [Fig. 9.8(b)]. The cells then begin to form groups that develop into different tissues and organs of the body. This developing structure is termed an embryo. The embryo gets embedded in the wall of the uterus for further development [Fig. 9.8(c)]. The embryo continues to develop in the uterus. It gradually develops body
 Uterus
 Ovary Zygote
 A zygote is formed as a result of fertilisation.
 "
Write difference between internal fertilization and external fertilization. ,"External Fertilization Internal fertilization Fertilization that takes place inside the female body is called internal fertilization. e.g., Human, cats, Dogs. Fertilization in which the fusion of a male and a female gamete takes place outside the body of the female is called extenal fertilization. e.g., fish, star fish etc.","You will be surprised to know that in many animals fertilisation takes place outside the body of the female. In these animals, fertilisation takes place in water. Let us find out how this happens.
 Activity 9.1 Visit some ponds or slow-flowing streams during spring or rainy season. Look out for clusters of f r og’s eggs floating in water. Write down the colour and size of the eggs.
 As the eggs are laid, the male deposits sperms over them. Each sperm swims randomly in water with the help of its long tail. The sperms come in contact with the eggs. This results in fertilisation. This type of fertilisation in which the fusion of a male and a female gamete takes place outside the body of the female is called external fertilisation. It is very common in aquatic animals such as fish, starfish, etc.
 As the eggs are laid, the male deposits sperms over them. Each sperm swims randomly in water with the help of its long tail. The sperms come in contact with the eggs. This results in fertilisation. This type of fertilisation in which the fusion of a male and a female gamete takes place outside the body of the female is called external fertilisation. It is very common in aquatic animals such as fish, starfish, etc.
 "
What is IVF ?,"IVF is In-vitro fertilization. In such cases the doctor collects freshly released egg and sperm and keep them together for a few hours for fertilization. When fertilization occurs, the zygote is formed and allowed to develop for about a week and then, it is placed in the mother’s uterus. Babies born through this technique are called test-tube baby.","Have you heard of test tube babies? Boojho and Paheli’s teacher once told them in the class that in some women oviducts are blocked. These women are unable to bear babies because sperms cannot reach the egg for fertilisation. In such cases, doctors collect freshly released egg and sperms and keep them together for a few hours for IVF or in vitro fertilisation (fertilisation outside the body). In case fertilisation occurs, the zygote is allowed to develop for about a week and then it is placed in the mother’s uterus. Complete development takes place in the uterus and the baby is born like any other baby. Babies born through this technique are called test-tube babies. This term is actually misleading because babies cannot grow in test tubes.
 "
Explain the structure of male reproductive system in human beings.,"Male reproductive system : The male reproductive organs include a pair of testes, two sperm ducts and a penis. The testes produce the male gametes called sperms. Millions of sperms are produced by the testes.","Male Reproductive Organs Head
 The male reproductive organs include a pair of testes (singular, testis), two sperm ducts and a penis (Fig. 9.1). The testes produce the male gametes called sperms. Millions of sperms are produced by the testes. Look at Fig. 9.2 which shows the picture of a sperm. Though sperms are very small in size, each has a head, a middle piece and a tail. Does it appear to be a single cell? Indeed, each
 The male reproductive organs include a pair of testes (singular, testis), two sperm ducts and a penis (Fig. 9.1). The testes produce the male gametes called sperms. Millions of sperms are produced by the testes. Look at Fig. 9.2 which shows the picture of a sperm. Though sperms are very small in size, each has a head, a middle piece and a tail. Does it appear to be a single cell? Indeed, each
 "
Why the new individual inherits some characteristics from the mother and some from the father ?,The process of fertilization is the meeting of an egg cell from the mother and a sperm cell from the father. So the new individual inherits some characteristics from the mother and some from the father.,"Fertilisation The first step in the process of reproduction is the fusion of a sperm and an ovum. When sperms come in contact with an egg, one of the sperms may fuse with the egg. Such fusion of the egg and the sperm is called fertilisation (Fig. 9.5). During fertilisation, the nuclei of the sperm and the egg fuse to form a single nucleus. This results in the formation of a fertilised egg or zygote (Fig. 9.6). Did
 The process of fertilisation is the meeting of an egg cell from the mother and a sperm cell from the father. So, the new individual inherits some characteristics from the mother and some from the father. Look at your brother or sister. See if you can recognise some characters in them similar to those of your mother or your father. Fertilisation which takes place inside the female body is called internal fertilisation. Internal fertilisation occurs in many animals including humans, cows, dogs and hens.
 The process of fertilisation is the meeting of an egg cell from the mother and a sperm cell from the father. So, the new individual inherits some characteristics from the mother and some from the father. Look at your brother or sister. See if you can recognise some characters in them similar to those of your mother or your father. Fertilisation which takes place inside the female body is called internal fertilisation. Internal fertilisation occurs in many animals including humans, cows, dogs and hens.
 "
How does external fertilization takes place ? Explain with an example.,"Fertilization in which the fusion of a male and a female gamete takes place outside the body of a female is called external fertilization. It is very common in aquatic animals. During spring or rainy season, frogs and toads move to ponds and slow flowing streams. When the male and female come together in water, the female lays hundreds of eggs. A layer of jelly holds the eggs together and provides protection to the eggs. The male deposits sperm over them. The sperms come in contact with the eggs. This results in fertilization.","As the eggs are laid, the male deposits sperms over them. Each sperm swims randomly in water with the help of its long tail. The sperms come in contact with the eggs. This results in fertilisation. This type of fertilisation in which the fusion of a male and a female gamete takes place outside the body of the female is called external fertilisation. It is very common in aquatic animals such as fish, starfish, etc.
 During spring or rainy season, frogs and toads move to ponds and slowflowing streams. When the male and female come together in water, the
 "
Why do fishes and frogs lay eggs in hundreds ?,"This is because the eggs and sperms get exposed to water movement, wind and rainfall. There are other animals in the pond, which may feed on eggs. Thus production of large number of eggs and sperms is necessary to ensure fertilization of atleast a few of them. 3","You will be surprised to know that in many animals fertilisation takes place outside the body of the female. In these animals, fertilisation takes place in water. Let us find out how this happens.
 Activity 9.1 Visit some ponds or slow-flowing streams during spring or rainy season. Look out for clusters of f r og’s eggs floating in water. Write down the colour and size of the eggs.
 As the eggs are laid, the male deposits sperms over them. Each sperm swims randomly in water with the help of its long tail. The sperms come in contact with the eggs. This results in fertilisation. This type of fertilisation in which the fusion of a male and a female gamete takes place outside the body of the female is called external fertilisation. It is very common in aquatic animals such as fish, starfish, etc.
 Though these animals lay hundreds of eggs and release millions of sperms, all the eggs do not get fertilised and develop into new individuals. This is because the eggs and sperms get exposed to water movement, wind and rainfall. Also, there are other animals in the pond which may feed on eggs. Thus, production of large number of eggs and sperms is necessary to ensure fertilisation of at least a few of them.
 "
Define asexual reproduction. Describe two methods of asexual reproduction. ,"Reproduction in which only a single parent is involved is called asexual reproduction. Two methods of asexual reproduction.   Budding  Binary fission  Budding : In hydra there may be one or more bulges. These bulges are developing new individuals and they are called buds. When new individuals develop from the buds, it is called budding.  Binary fission : The process of reproduction by the division of its nucleus into two nuclei. This is followed by division of its body into two where each part receives a nucleus as it finally two amoebae are produced.","In each hydra, there may be one or more bulges. These bulges are the developing new individuals and they are called buds. Recall the presence of buds in yeast. In hydra too the new individuals develop as outgrowths from a single parent. This type of reproduction in which only a single parent is involved is called asexual reproduction. Since new individuals develop from the buds in hydra, this type of asexual reproduction is called budding. Another method of asexual reproduction is observed in the microscopic organism, amoeba. Let us see how this happens. You have already learnt about the structure of amoeba. You will recall that amoeba is a single-celled organism [Fig. 9.12(a)]. It begins the process of reproduction by the division of its nucleus into two nuclei [Fig. 9.12(b)]. This is followed by division of its body into two, each part receiving a nucleus [Fig. 9.12(c)]. Finally, two amoebae are produced from one parent amoeba [Fig. 9.12(d)]. This type of asexual
 "
How do some micro-organisms clean up the environment ?,Some micro-organisms decompose the organic waste and dead plants and animals into simple substance and clean up the environment.,"Some microorganisms decompose the organic waste and dead plants and animals into simple
 PATHOGEN PRESERVATION PROTOZOA RHIZOBIUM
 substances and clean up the environment. Ü
 "
What is the basis of the use of yeast in the baking industry ?,Yeast reproduces rapidly and produces carbon dioxide during respiration. Bubbles of gas fill the dough and increase its volume. This is the basis of the use of yeast in baking industry.,"Yeast r eproduces rapidly and produces carbon dioxide during respiration. Bubbles of the gas fill the dough and increase its volume (Fig. 2.6). This is the basis of the use of yeast in the baking industry for making breads, pastries and cakes. Commercial Use of Microorganisms Microorganisms are used for the large scale production of alcohol, wine and acetic acid (vinegar). Yeast is used for commercial production of alcohol and wine. For this purpose yeast is grown on natural sugars present in grains like barley, wheat, rice, crushed fruit juices, etc.
 "
What are communicable diseases ?,"Microbial diseases that can spread from an infected person to a healthy person through air, water food or physical contact, are called communicable diseases. e.g. cholera, common cold etc.","microorganisms are called pathogens. Some microorganisms spoil food, clothing and leather. Let us study more about their harmful activities. Disease causing Microorganisms in Humans Pathogens enter our body through the air we breathe, the water we drink or the food we eat. They can also get transmitted by direct contact with an infected person or carried by an animal. Microbial diseases that can spread from an infected person to a healthy person through air, water, food or physical contact are called communicable diseases. Examples of such diseases include cholera, common cold, chicken pox and tuberculosis. When a person suffering from common cold sneezes, fine droplets of moisture carrying thousands of viruses are spread in the air. The virus may enter the body of a healthy person while breathing and cause infection.
 There are some insects and animals which act as carriers of diseasecausing microbes. Housefly is one such carrier. The flies sit on the garbage and animal excreta. Pathogens stick to their bodies. When these flies sit on uncovered food they may transfer the pathogens. Whoever eats the contaminated food is likely to get sick. So, it is advisable to always keep food covered. Avoid consuming uncovered items of food. Another example of a carrier is the female Anopheles mosquito (Fig. 2.8), which carries the parasite of malaria (Plasmodium). Female Aedes mosquito acts as carrier of dengue virus. How can we control the spread of malaria or dengue?
 There are some insects and animals which act as carriers of diseasecausing microbes. Housefly is one such carrier. The flies sit on the garbage and animal excreta. Pathogens stick to their bodies. When these flies sit on uncovered food they may transfer the pathogens. Whoever eats the contaminated food is likely to get sick. So, it is advisable to always keep food covered. Avoid consuming uncovered items of food. Another example of a carrier is the female Anopheles mosquito (Fig. 2.8), which carries the parasite of malaria (Plasmodium). Female Aedes mosquito acts as carrier of dengue virus. How can we control the spread of malaria or dengue?
 Fig. 2.8 : Female Anopheles mosquito
 Then how do you prevent the spread of communicable diseases?
 "
What are general preventive measures to protect ourselves from cholera ?,To prevent ourselves from cholera we should maintain personal hygiene and good sanitary habits. ,"Maintain personal hygiene and good sanitary habits. Consume properly cooked food and boiled drinking water. Vaccination.
 "
How are micro-organisms useful for commercial productions ?,"Micro-organisms are commercially used for the large scale production of alcohol, wine and acetic acid. Yeast is commonly used for commercial production of wine and alcohol.","Yeast r eproduces rapidly and produces carbon dioxide during respiration. Bubbles of the gas fill the dough and increase its volume (Fig. 2.6). This is the basis of the use of yeast in the baking industry for making breads, pastries and cakes. Commercial Use of Microorganisms Microorganisms are used for the large scale production of alcohol, wine and acetic acid (vinegar). Yeast is used for commercial production of alcohol and wine. For this purpose yeast is grown on natural sugars present in grains like barley, wheat, rice, crushed fruit juices, etc.
 "
Who discovered the first antibiotic ? Name any two antibiotics.,Alexander Fleming discovered first antibiotic penicillin. Two other common antibiotics are streptomycin and tetracycline.,"Whenever you fall ill the doctor may give you some antibiotic tablets, capsules or injections such as of penicillin. The source of these medicines is microorganisms. These medicines kill or stop the growth of the disease-causing microorganisms. Such medicines are called antibiotics. These days a number of antibiotics are being produced from bacteria and fungi. Streptomycin, tetracycline and erythromycin are some of the
 Activity 2.4 Take a 500 mL beaker filled upto ¾ with water. Dissolve 2-3 teaspoons of sugar in it. Add half a 20
 In 1929, Alexander Fleming was working on a culture of diseasecausing bacteria. Suddenly he found the spores of a little green mould in one of his culture plates. He observed that the presence of mould prevented the growth of bacteria. In fact, it also killed many of these bacteria. From this the mould penicillin was prepared. SCIENCE
 In 1929, Alexander Fleming was working on a culture of diseasecausing bacteria. Suddenly he found the spores of a little green mould in one of his culture plates. He observed that the presence of mould prevented the growth of bacteria. In fact, it also killed many of these bacteria. From this the mould penicillin was prepared. SCIENCE
 "
Why are vaccines so important for children ?,"By introducing vaccine in body, the body fights and kills the bacteria by producing suitable antibodies. The antibodies remain in the body and the child is protected from the disease causing microbes.","Vaccine
 Why are children/infants given vaccination?
 When a disease-carrying microbe enters our body, the body produces antibodies to fight the invader. The body also remembers how to fight the microbe if it enters again. If dead or weakened microbes are introduced into a healthy body, the body fights and kills the invading bacteria by producing suitable antibodies. The antibodies remain in the body and we are protected
 When a disease-carrying microbe enters our body, the body produces antibodies to fight the invader. The body also remembers how to fight the microbe if it enters again. If dead or weakened microbes are introduced into a healthy body, the body fights and kills the invading bacteria by producing suitable antibodies. The antibodies remain in the body and we are protected
 from the disease-causing microbes for ever. This is how a vaccine works. Several diseases, including cholera, tuberculosis, smallpox and hepatitis can be prevented by vaccination.
 from the disease-causing microbes for ever. This is how a vaccine works. Several diseases, including cholera, tuberculosis, smallpox and hepatitis can be prevented by vaccination.
 Edward Jenner discovered the vaccine for smallpox in 1798.
 In your childhood, you must have been given injections to protect yourself against several diseases. Can you prepare a list of these diseases? You may take help from your parents. It is essential to protect all children against these diseases. Necessary vaccines are available in the nearby hospitals. You might have seen the advertisement on TV and newspapers regarding protection of children against polio under the Pulse Polio Programme. Polio drops given to children are actually a vaccine. A worldwide campaign against smallpox has finally led to its eradication from most parts of the world. These days vaccines are made on a large scale from microorganisms to protect humans and other animals from several diseases. Increasing Soil Fertility Some bacteria (Fig. 2.7) are able to fix nitrogen from the atmosphere to enrich soil with nitrogen and increase its fertility. These microbes are commonly called biological nitrogen fixers. 21
 "
How common cold spreads from infected person to a healthy person ?,"When a person suffering from common cold sneezes, fine droplets of moisture carrying thousands of viruses are spread in the air. The virus may enter the body of a healthy person while breathing. MICRO-ORGANISMS : FRIEND AND FOE","microorganisms are called pathogens. Some microorganisms spoil food, clothing and leather. Let us study more about their harmful activities. Disease causing Microorganisms in Humans Pathogens enter our body through the air we breathe, the water we drink or the food we eat. They can also get transmitted by direct contact with an infected person or carried by an animal. Microbial diseases that can spread from an infected person to a healthy person through air, water, food or physical contact are called communicable diseases. Examples of such diseases include cholera, common cold, chicken pox and tuberculosis. When a person suffering from common cold sneezes, fine droplets of moisture carrying thousands of viruses are spread in the air. The virus may enter the body of a healthy person while breathing and cause infection.
 "
Name one viral and one fungal disease in plants.,Viral disease : Yellow vein mosaic of Bhindi . Fungal disease : Rust of wheat.,"Yellow vein mosaic of bhindi (Okra)
 "
How housefly makes us sick ?,Housefly is a carrier of disease-causing microbes. The flies sit on the garbage and animal excreta. Pathogens stick to their bodies. When these flies sit on uncovered food they may transfer these pathogens. Whoever eats this contaminated food is likely to get sick. 3,"There are some insects and animals which act as carriers of diseasecausing microbes. Housefly is one such carrier. The flies sit on the garbage and animal excreta. Pathogens stick to their bodies. When these flies sit on uncovered food they may transfer the pathogens. Whoever eats the contaminated food is likely to get sick. So, it is advisable to always keep food covered. Avoid consuming uncovered items of food. Another example of a carrier is the female Anopheles mosquito (Fig. 2.8), which carries the parasite of malaria (Plasmodium). Female Aedes mosquito acts as carrier of dengue virus. How can we control the spread of malaria or dengue?
 "
Who discovered the bacterium Bacillus anthracis ? Which disease can be caused by it ? Is it harmful ?,"Robert Koch  discovered the bacterium Bacillus anthracis, which causes anthrax disease. It is dangerous for human and cattle both.","Some of the common diseases affecting humans, their mode of transmission and few general methods of prevention are shown in Table 2.1. Disease causing Microorganisms in Animals Several microorganisms not only cause diseases in humans and plants, but also Robert Köch (1876) discovered the bacterium (Bacillus anthracis) which causes anthrax disease.
 "
Why are salt and edible oils also called preservatives ? Name two chemicals that are used as common preservatives.,Salt and edible oils are the common chemicals generally used to check the growth of microorganism. Sodium benzoate and metadisulphate are common preservatives. ,"Chemical Method Salts and edible oils are the common chemicals generally used to check the growth of microorganisms. Therefore they are called preservatives. We add salt or acid preservatives to pickles to prevent the attack of microbes. Sodium benzoate and sodium metabisulphite are common preservatives. These are also used in jams and squashes to check their spoilage. Preservation by Common Salt Common salt has been used to preserve meat and fish for ages. Meat and fish are covered with dry salt to check the growth of bacteria. Salting is also used to preserve amla, raw mangoes, tamarind, etc. Preservation by Sugar Jams, jellies and squashes are preserved by sugar. Sugar reduces the moisture content which inhibits the growth of bacteria which spoil food. Preservation by Oil and Vinegar Use of oil and vinegar prevents spoilage of pickles because bacteria cannot live in such an environment. Vegetables, fruits, fish and meat are often preserved by this method. Heat and Cold Treatments You must have observed your mother boiling milk before it is stored or used. Boiling kills many microorganisms.
 "
Draw structure of virus and amoeba.,Virus : ,"Virus
 "
