questions,answers
How was the education policy unfavourable to the Vietnamese students during the colonial period ? Explain. ,"Education policy unfavourable to the Vietnamese students :  The Tonkin Free School was started in 1907 to provide a Western-style education. This education included classes in science, hygiene and French.  The school encouraged the adoption of Western styles such as having a short haircut.  For the Vietnamese this meant a major break with their own identity.  Teachers and students did not blindly follow the curriculum. Sometimes there was open opposition and at other times there was silent resistance.  As the number of Vietnamese teachers increased in the lower classes, it became difficult to control what was actually taught.  School textbooks glorified the French and justified the colonial rule.  The Vietnamese were represented as primitive and backward capable of manual labour but not of  1 × 3 = 3 intellectual reflection. "
Describe the influence of China China on Vietnamese culture and life. , Vietnam initially was under the shadow of China.  Even after independence Vietnam followed Chinese culture and their form of government.    Chinese was the language of the elite and Confucianism was followed by a majority of Vietnamese. The Vietnamese Scholar Phan Boi Chau was educated in Confucian tradition.  1 × 3 = 3
Write any three three primary objectives objectives of the ‘Go East Movement’ in Vietnam. ,Refer to of Q1 Long Type Ques.
How did students in Vietnam fight against the colonial government’s efforts to prevent Vietnamese from qualifying for ‘White Collar Jobs’ ? ," Students formed political parties. Such as the party of yong Annan.  They even published nationalist journals.  During the ‘Go East Movement’, many students went to Japan to acquire modern education. 1 × 3 = 3"
Explain the idea of Phan Chu Trinh to establish a Democratic Republic in Vietnam. , Phan Chu Trinh was a nationalist. He sought to end France’s brutal occupation of Vietnam.  He was intensely hostile to monarchy and opposed the idea of resisting the French with the help of the Court.  He demanded that the French set up legal and educational institutions and should develop agriculture and industry.  1 × 3 = 3
Who was Phan Chu Trinh? How did he help in the modernisation of Vietnam ?  THE NATIONALIST MOVEMENT IN INDO-CHINA Explain the views of Phan Chu Trinh as a Nationalist. , He was a nationalist.   He sought to end France’s France’s brutal occupation of Vietnam.  He was intensely hostile to monarchy and opposed the idea of resisting the French with the help of the court.  He wanted to establish a democratic republic.  He was influenced by western ideals like liberty.  He demanded that the French set up legal and educational institutions and should develop  1 + 2 = 3 agriculture and industries.
Who was Ho Chi Minh ? What was his contribution to Vietnam ? ,Refer to of Q.7 Long Answer Type Questions.
