questions,answers
Why has the ‘National Manufacturing Competitiveness Council’ been set up ? ,"To improve the productivity, economist predict that manufacturing can achieve its target over the next decades.  1"
Why is the ‘least cost’ known as decision making factor for ideal location of an industry? ,Manufacturing activity tends to locate at the most appropriate place where all the factors of industrial  locations are either available or can be arranged at a lower cost.  1
What is Manufacturing?,Production of goods in large quantities after processing from raw materials to more valuable products is called as Manufacturing.
Which factor has influenced Indian economy and standard of living of the people?,Industrial Revolution.
Name four main factors of production in modern industry.,"Raw material, Trained/specialised labour, Capital, Sources of power."
