questions,answers
What name is given to the period between childhood and adulthood ?,Adolescence.
What is puberty ?,The human body undergoes several changes during adolescence. These changes mark the onset of puberty.
When does puberty end ?,Puberty ends when an adolescent reaches reproductive maturity.
Write two changes which occur during puberty., Increase in height  Change in body shape.
Why during adolescence voice of some boys becomes hoarse ?,Because boys develop large voice boxes. It can be seen as a protruding part of the throat called Adam’s apple.
Write a myth regarding body changes in adolescence.,A girl gets pregnant if she looks at boys during menstruation.
What is the legal age of boy and girl for marriage ?,Marriage age for boys is 21 years while that of girls is 18 years.
Name a dangerous viral disease.,AIDS by virus HIV.
Why we should say ‘No’ to Drugs ?,They ruin health and happiness both.
