questions,answers
How is democracy accountable and responsible to the needs and expectations of the citizens ?  Analyse.,"Democracy is accountable and responsive to the needs and expectations of the citizens because :  In a democracy, people have the right to choose their representatives and the people will have control over them.  Citizens have the right to participate in decisionmaking that affects them all. This ensures that the working of the government is transparent.  Everybody expects the government to be attentive to the needs and expectations of the people.  It is expected that the democratic government develops mechanisms for citizens to hold the government accountable.  The opposition parties can also question and criticize the government policies. They keep a check on the ruling party and make sure that it does not misuse the power.  1 × 3 = 3 "
“Some people think that democracy produces a less effective government.“ Analyse the statement. ,"It is true some people think that democracy produces a less effective government because :  Non-democratic rulers do not have to bother about deliberation in assemblies or worry about majorities and public opinion.  They can be very quick and efficient in decisionmaking and implementation.  But democracy is based on the idea of deliberation and negotiation. So, some delay is bound to take place.  Most democracies fall short of elections that provide a fair chance to everyone.  Democratic governments do not have a very good record when it comes to sharing information with citizens.  Democracies often frustrate the needs of the people and often ignore the demands of a majority of its population.  1 × 3 = 3 "
‘‘Transparency is the most important feature of democracy.’’ Analyse. ,"Transparency is the most important feature of democracy :  Democracy ensures that decision-making will be based on certain norms and procedures.  So, a citizen who wants to know if a decision was taken through correct procedures can find this out.  The citizen has the right and the means to examine the process of decision-making. This is known as transparency. "
How are the democratic governments better than the other forms of governments? Compare.  “Democracy is a better form of government than any other form of government.” Analyse the statement with arguments.  Why do we feel that democracy is a better form of government than any other form ? Explain. ,"The democratic governments are better than other forms of governments because :  Democratic governments have formal Constitution, while it is not the case in other form of governments.  They hold regular elections, while it is not the case in other form of governments.  They have political parties, whereas there is no such thing in other form of governments.  They guarantee rights to citizens, while it is not the case in the other form of governments.  Such governments allow room to correct mistakes, while it is not there in the other form of government.  Such government accommodates social diversities, while no such thing in other form of government.  1× 5 = 5 "
‘‘A democratic government is efficient and effective.’’ Analyse the statement.  “The cost of time that democracy pays is perhaps worth it.” Justify.," Imagine a government that may take decisions very fast. But it may take decisions that are not accepted by the people and may, therefore, face problems.  In contrast, the democratic government will take more time to follow procedure before arriving at a decision.  However, because it has followed procedure, its decisions may be more acceptable to the people and more effective. So, the cost of time that democracy pays is perhaps worth it. "
“Democracies are not appearing to be very successful in reducing economic inequalities.” Analyse the statement. ,"Democracy and the economic outcomes :  Slow economic development and economic growth due to population.  Basic needs of life, such as food clothing, shelter are difficult to achieve.  Prevalence of economic inequalities.  Poverty is still a big issue.  Allocation of resources in few hands.  Unjust distribution of goods and opportunities.  1 × 5 = 5 "
"Evidence shows that in practice, many democracies did not fulfill the expectations of producing economic development in the country. Validate the statement with the help of relevant example. "," If we consider all democracies and all dictatorships for the fifty years between 1950 and 2000, dictatorships have slightly higher rate of economic growth.  Economic development depends on several factors : country‘s population size, global situation, cooperation from other countries, economic priorities adopted by the country, etc.  However, the difference in the rates of economic development between less developed countries with dictatorships and democracies is negligible.  Overall, it cannot be said that democracy is a guarantee of economic development. But we can expect democracy not to lag behind dictatorships in this respect.  With such a significant difference in the rates of economic growth between countries under dictatorship and democracy, it is better to prefer democracy as it has several other positive outcomes. For example : North Korea has higher rate of economic growth than India.  Value"
