,questions,answers
0,Q. 37. How many chambers are there in a heart of cockroach ?,Ans. Thirteen.
1,Q. 38. What are setae ?,Ans. Setae are made up of chitin and help in locomotion of earthworm.
2,Q. 39. What is haemolymph ?,Ans. Haemolymph is the blood of cockroach having composed of colourless plasma and many corpuscles called haemocytes.
3,Q. 40. What is the function of nephridia ?,Ans. Excretion.
4,Q. 41. How many types of nephridia are found in earthworm based on their location ?,"Ans. There are of three types of nephridia in the earthworm, viz., septal nephridia, integumentary nephridia and pharyngeal nephridia."
5,Q. 42. What are the visual units of compound eyes called ?,Ans. The visual units of compound eyes are called ommatidia.
6,Q. 43. Write the significance of typhlosolar region.,Ans. It increases the absorptive surface of the intestine.
7,Q. 44. What is a nymph ?,"Ans. The young one of an animal that resembles the adult in its mode of life but differs in structure is called nymph. e.g., young one of cockroach."
8,Q. 45. Name the cells in earthworm which are analogous to the liver of vertebrates.,Ans. Chloragogen cells.  
