,questions,answers
0,"Q. 1. Describe the three factors which determine the outcome of the politics of social divisions. [Board Term-I, Term-I, Set  2016-17]","Ans. Factors that decide the outcome of the politics of social divisions.  The people’s perception of their identities : When this is singular, the accommodation of other identities becomes difficult.  Representation of a community by political leaders : While representing a community, if politicians raise demands that are constitutional, then, it is easier to accommodate those demands.  The government’s reaction : If the reasonable demands of a community are suppressed by the government, then it leads to social divisions, which in turns threaten the integrity of the country."
1,"Q. 2. Describe three advantages of the political expression of caste differences. [Board Termerm-I, I,  2015]",Ans. Advantages of the political expression of caste differences are :  It gives disadvantaged groups the opportunity to demand a share in power and decision- making. 1 mark each 3 marks each  Many political parties take up the issue of ending caste discrimination.  Measures for uplifting the status of the backward backward castes will be undertaken.
2,Q. 3. Describe the adverse effects of caste in politics in India.,Ans. Adverse effects of caste in politics in India :  Political parties try to use caste to gain votes. votes.  Promise to take care care of interests and demands of different castes.  Leads to conflicts and tensions among various caste groups.
3,"Q. 4. How does caste get politicised Give three [Board Term-I, Set  2011, points. Set  2010]",Ans.  Each caste group tries to become bigger by incorporating within its neighbouring castes or sub-castes which were earlier excluded from it.  Various caste groups are required to enter enter into a coalition with other castes or communities and thus enter into a dialogue and negotiation.  New kinds of caste groups have come up in the political area like ‘backward’ and ‘forward’ caste groups.
4,Q. 5. Why are caste barriers breaking down in India ? Explain with three reasons. ,"Ans. Caste barriers are breaking down in India due to the following reasons :  With the economic development, large scale urbanisation, growth of literacy and education, occupational mobility and the weakening of the position of landlords in the villages, the old notions of caste hierarchy are breaking down.  Due to socio-economic changes, i.e., now, most of the times, in urban areas it does not matter much who is walking along next to us on street or eating at the next table in a restaurant.  The Constitution Constitution of India prohibited any castebased discrimination and laid the foundations of policies to reserve the injustices of the caste system."
5,"Q. 6. Explain the impact of caste system on Indian Term-I, Set  2011] democracy. [Board Term-I,","Ans. Impact of caste system system on Indian democracy : differences in politics gives  Expression of caste differences many disadvantaged communities the space to demand this share of power. In this sense caste politics has helped people from Dalits and OBC caste to gain better access to decision-making.  Several political and non-political organizations have been demanding and agitating for an end to discrimination against particular castes, for more dignity and more access to land, resources and opportunities.  Exclusive attention can produce negative results as well. It can divert attention from other pressing issues such as poverty, development and corruption. In some cases it leads to violence."
6,"Q. 7. “Caste has not still disappeared from contemporary India.” Write any three examples to justify the statement. [Board Term-I erm-I,, Set  2011]","Ans. Caste has not disappeared from contemporary India. Some of the older aspects of caste which are persisting are as follows :  Even now most people marry marry within their their own caste or tribe.  Untouchability has not ended completely, despite constitutional prohibition. "
