,questions,answers
0,Q. 1. What steps should be taken to make trade more fair between the countries ? 			 ,Ans. The following steps should be taken :  Before imposing trade barrier interest of the developing countries should be taken care.  Rules and regulations should be uniform.  Ensure that the developed countries do not retain trade barriers unfairly.  Labour laws should be implemented properly.  Small producers should be supported to improve their performace till they become strong enough to compete. 
1,Q. 2. Describe any five factors that promote the Multinational Corporations  to set up their production units in a particular place. ,Ans. Factors that promotes MNCs :  Close proximity to the market.  Availability of skilled and unskilled labour at low cost.  Assured production.  Governments liberalised policies.  Developed infrastructure.  Safety measures.  1×5=5 
2,Q. 3. The impact of globalisation has not been uniform.” Demonstrate with the help of illustrations” ,"Ans.  While globalisation has benefited welloff consumers and also producers with skill, education and wealth, many small producers and workers have suffered as a result of the rising competition.  Removal of trade barriers and liberlisation policies of the governments to facilitate globalisation have hit the local producers and manufactures hard.  Globalisation and the pressure of competition have substantially changed the lives of workers. Faced with growin competition, most employers these days prefer to employ workers ‘flexibly’. This means that workers’ jobs are no longer secure. Illustration : Any one case—either from the text book or beyond it e.g. MNCs and Workers, MNCs and Local Manufactures/industries, Withdrawal of Subsidies etc. "
3,Q. 4. How are Multinational Corporations  controlling and spreading their productions across the world ? Explain. ,Ans. The Multinational Corporations  controlling and spreading their production across the world :  MNCs set up their production units close to market.   MNCs set up production units jointly with local companies.  They set up units where there is skilled and unskilled labour available at low cost.  Large MNCs in developed countries place orders for productions with small producers.  They have tremendous power to determine price quality delivery and labour conditions for distant producers.  Buying local companies.  1 × 5 = 5 
4,Q. 5. “Globalisation and greater competition among producers has been advantageous to consumers.” Support the statement with examples. ,"Ans. Globalisation and greater competition among producers has been advantageous to consumers :  Globalization and greater competition among producers both local and foreign has been of advantageous to consumers, particularly the well off sections of urban areas.  There is greater choice before these consumers who now enjoy improved quality and lower prices for several products.  People enjoy higher standards of living.  But the impact of globalisation has not been uniform among producers and workers.  Services of the top Indian companies have been able to benefit from the increased competition.  They have invested in newer technology and production methods and raised their production standards.  Wide ranging choice of goods in our markets is a recent phenomenon and have brought changes in lives of people.  1 × 5 = 5 "
5,Q. 6. How has information and communication technology stimulated globalisation process ? Explain with examples. ,"Ans. Rapid improvement in technology has stimulated the globalisation process :  Transportation technology has made much faster delivery of goods across long distances possible at lower costs.  There are even more remarkable developments in information and communication technology.  Telecommunication facilities are used to contact one another around the world, to access information instantly, and to communicate from remote areas.  Through internet, one can obtain and share information on almost anything. It also allows to send e-mail and talk across the world at negligible costs.  5"
6,Q. 7. ‘‘Globalisation has been advantageous to consumers as well as to producers.’’ Support the statement with suitable examples. ,"Ans. Globalisation has been advantageous to producers in the following ways :  The producers now have access to the international markets.  Globalisation has also enabled free movement of capital, i.e., via electronic transfers, etc.  Globalisation has enabled access to foreign investment in capital and technology via Foreign Direct Investment, etc. Globalisation has been advantageous to consumers in the following ways :  Globalisation has led to employment generation, as a result, beneficial to the consumers.  Globalisation has also given rise to intense competition due to opening up of markets to foreign companies. As a result, this has led to the increase in product quality and decrease in the prices of the products.  The consumers have benefited from the arrival of MNCs as they have now larger choice in the goods that are available to them in the market.  2½ + 2½ = 5"
7,Q. 8. Explain the role of Multinational Corporations in the globalisation process.,"Ans. MNCs play an important role in the globalisation process.  MNCs control production in more than one country.  They compete with the local producers directly even after being miles apart, thus integrating the markets.  Their working leads to exchange of investments and products which leads to interconnection between diverse countries. Countries get linked when movement of goods, people, investment and services between different countries takes place. They can be linked as producers or consumers of same products or one can be a producer and the other consumer. The recent advancement in technology, transport and communication systems has enhanced globalisation.  5"
