questions,answers
What is osmoregulation ?,Osmoregulation is the maintenance of optimum concentration of water and salts in the body fluids.
Which organ synthesises urea ?,Liver synthesises urea.
Why ammonia is converted to uric acid crystals directly in uricotelic organisms ?,"Animals, which live in dry conditions have to conserve water in their bodies. Therefore, they synthesise crystals of uric acid from their ammonia."
Mention the respiratory unit of lungs and excretory unit of kidneys. ,Respiratory unit of lungs — Alveoli Excretory unit of kidneys — Nephrons
What causes the liquid part of blood to filter out from the glomerulus into the renal tubule ?,High pressure causes the liquid part of blood to filter out from the glomerulus into the renal tubule.
