questions,answers
What does the system of checks and balances’ ensure in power sharing ? ,That none of the organs of the government can exercise unlimited power.  1
"Which system of power sharing is called, ‘Checks and Balances’ ?",Horizontal distribution of powers.
Mention any one characteristics of power sharing. ,It gives the people right to be consulted or any other characteristics.  1
Which type of powers does the Community Government of Belgium enjoy ? ,"This government has the power regarding culture, education and language related issues."
What is the prudential reason behind power  Why power sharing is good for democracies ?,It reduces the possibility of conflict between social groups.
