questions,answers
Why is NREGA also called the right to work ? Explain.  Or 		 Explain the role of NREGA is creating employment for the people in India.  ," Unemployment : When a person is willing to work at the prevailing wage rate but fails to get a job, it is called unemployment.  Or 		Why is NREGA also called the “Right to Work”? Mention any three reasons for it.  Or 		In your opinion, how far is it correct to say that NREGA 2005 as “Right to Work”? "
Explain the concept of under employment taking example from some non-agricultural field. ,"Ans.		NREGA is also called Right to Work :  It has been implemented in 200 poorest of the poor districts of India.  NREGA guarantees 100 days of assured work to the people who are able and in need of work.  If the government fails to provide work, it will provide unemployment allowances to the people.  One-third of the jobs are reserved for women.   3"
Explain the concept of under employment taking example from some non-agricultural field. ,"Ans.		NREGA is also called Right to Work :  It has been implemented in 200 poorest of the poor districts of India.  NREGA guarantees 100 days of assured work to the people who are able and in need of work.  If the government fails to provide work, it will provide unemployment allowances to the people.  One-third of the jobs are reserved for women.   3"
What is GDP ? Explain with example the method of calculating Gross Domestic Product.  Or 		Explain the term G.D.P. Why are only ‘final goods and services’ counted in G.D.P. ? ,Ans.		Objectives of implementing MGNREGA 2005 :  To give employment opportunities to the people who live in rural areas.  To raise the standard of living of the people.  To implement the right to work.  1 × 3 =3
What is GDP ? Explain with example the method of calculating Gross Domestic Product.  Or 		Explain the term G.D.P. Why are only ‘final goods and services’ counted in G.D.P. ? ,Ans.		Objectives of implementing MGNREGA 2005 :  To give employment opportunities to the people who live in rural areas.  To raise the standard of living of the people.  To implement the right to work.  1 × 3 =3
Explain the ways by which more employment can be created in a country like India. ,"The ways by which more employment can be created in a country like India are :  If more dams are built and canal water is provided to all the small farmers, a lot of employment can be generated in agriculture sector.   Providing cheap credit facilities and crop insurance can result in more employment. More money should be spent in transport and storage, because then more people can be employed. The government/banks can provide loan at cheap rates to improve irrigational facilities. Technical training, vocational guidance to unemployed youth for self employment.  1 × 3 = 3  "
