questions,answers
Describe the Germany. process of o f unification u nification of of ,"Unification of Germany : Nationalist feelings were widespread among middle class farmers. In 1848, they tried to unify Germany into a nation. This feeling was repressed by the combined forces of the monarchy and the military. From then on Prussia took on the leadership of unification of Germany. Its Chief Minister, Otto von Bismarck was the architect of this process. He took the help of military and bureaucracy. Three wars over seven years ended in Prussian victory and completed the process of unification. The Prussian King William-I was proclaimed German Emperor in January 1871.  5"
Describe the process of Unification of Italy. ,"The Unification of Italy : During the middle of the 19th century, Italy was divided into seven states. During 1830, Mazzini decided to unite Italy. He had formed a secret society ‘Young Italy’ to achieve his goal. After earlier failures in 1831 and 1848 King Victor Emmanuel-II took to unify the Italian states through wars. Through a tactful diplomatic alliance with France by Cavour Sardinia-Piedmont succeeded in defeating the Austrian forces in 1859. Under the leadership of Garibaldi armed volunteers marched into South Italy in 1860 and the kingdom of the Two Sicilies and succeeded in winning the support of the local peasants in order to drive out the Spanish rulers. In 1861, Victor Emmanuel-II was proclaimed king of united Italy.  5 "
Explain the role of Giuseppe Mazzini in the the unification of Italy. ,Role of Mazzini in the unification of Italy were :  He became member of various secret societies such as ‘Young Italy’ or ‘Young Europe’.  He attempted revolution in Liguria.  He wanted unification with wider alliance of nations.  He frightened conservatives through opposition of monarchy and vision of democratic republics.  He favoured war for unification of Italy.  He wanted Economic development and Political dominance.  1 × 5 = 5 
Describe the process of Unification of Britain. Britain. ,"Unification of Britain : In Britain, the formation of the nation states was the result of long drawn out process. Primary identities of the people were ethnic ones. All ethnic groups such as English, Welsh Scot or Irish had their own cultural and political traditions. The English nation steadily grew in wealth and power. It was able to extend its influence over the other nations. The Act of Union 1707 between England and Scotland resulted in the formation of the United Kingdom of Great Britain.  5 reference to Scotland and Ireland, explain"
With reference how British nationalism grew at the cost of other cultures. ," Through the Act of Union , England was able to impose its influence on Scotland.  The growth of British identity id entity in Parliament suppressed the distinctive culture of Scotland.  The Catholic clans that inhibited the Scottish Highland suffered repression.  They were forcibly driven out of their homeland.  Ireland was also divided between Catholics and Protestants.  Ireland was forcibly incorporated in the UK.  1 × 5 = 5"
