questions,answers
Why should the use of cattle cake as fuel be discouraged ? ,The use of cattle cake as fuel should be discouraged because :  It creates pollution.  It consumes most valuable manure which could be used in agriculture.  1
How are ‘Gobar Gas Plants’ beneficial to the farmers ? ,‘Gobar Gas Plants’ are beneficial to the farmers in the form of energy and improved quality of manure. 
What is biogas energy ?,"Bio gas is produced from shrubs, farm waste, animal and human wastes."
Which countries lead in the production of nuclear power ?,The greatest producers of nuclear power are USA and Europe.
Name any one nuclear power station found in India ?,Kalpakkam in Tamil Nadu.
Name important hydel power station in India.,Bhakra Nangal.
"At which place in India, experimental project for geothermal energy has been set up ?",Manikaran.
