questions,answers
What led to the major expansion of Bombay’s population in the mid-nineteenth century ?   Or 		‘A large number of migrants were attracted to Bombay in the 20th century.’ Explain the statement. ," Bombay became the capital city of the Bombay presidency in 1819, hence more people began to settle in Bombay.  Growth of trade in cotton and opium led large communities of traders, bankers, artisans and shopkeepers came to settle in Bombay.  In 1854, cotton mills were established in Bombay. Most of the workers came from outside.  Large number of people came to work at the seaport and the railways which encouraged migration.  Famines in dry regions brought more people to Bombay. Bombay attracted many people to work in films too."
Describe the features of the big modern city of Calcutta  as viewed by the Gods in the novel written by Durgacharan Roy.  ,"In ‘Debganer Martye Agaman’ Brahma visits the city of Calcutta along with other Gods. They saw distraction by the train, large ships in the Ganga, factories, bridges, monuments, shops and the variety of gods sold in shops. However, they were disturbed to see cheats and thieves, poverty, poor housing, confusion of caste, religious and gender identities in the city. Brahma himself was trucked into buying a cheap pair of glasses. Durgacharan Ray describes the contrasting images and experience like wealth and poverty, splendour and diet, opportunities and disappointments that the cities offered. "
Describe the social life of people in . ," The city of Bombay was over crowded. As such, there was an interdependence among people.  The homes were small, so streets and neighbourhood were used for a variety of activities and social functions.  The rich people lived in spacious bungalows.  The working people lived in the thickly-populated Chawls of Bombay.  Shortage of water was a common phenomenon.  Lower caste people found it difficult to find housing."
Why has city life always attracted those seeking freedom and opportunity ? Explain. ," The city life symbolized freedom from the collective social values which people were compelled to follow in their villages.  There were numerous caste and community rules in the rural set-up which based when people moved to cities.  People became more free and they carried new ways of living.  The public transport system and multistoreyed housing loosened traditional regulations and people learned to live in multiethnic and multicultural environment brought from different places by migrants to the city.  The city symbolized self made people who come here to pursue their dreams.  City culture bought a wave of individualism and were supposed to be quite organised than the rural areas, so people who migrated found it attractive. "
What were ‘Chawls’ ? Describe the living conditions in chawls in Bombay.  Or 		 Describe the life of people who lived in the chawls of Bombay . ,"Chawls were the multi-storeyed structures built and owned by private landlord such as merchants, bankers and building contractors. Each Chawl is divided into smaller one - room tenements.  No private toilets. Many families could reside at a time in a tenement.  People used to keep windows closed because of the close proximity to filthy putter, buffalo stables etc.  Due to water scarce the people quarrelled every morning for a turn at the tap. Streets and Neighbourhoods areas were used for activities as cooking, washing, sleeping.  Liquor shops and Akharas in empty sports. Streets were used for leisure activities.  Chawls were also a place for exchanging news "
Explain any four causes of air pollution in Calcutta in 19th century and early 20th century. Which body controlled industrial pollution in Bengal ?  Or 		Calcutta  had a long history of ‘air pollution’. Explain any five reasons for it. ,"Causes :  Huge population depended on dung and wood as fuel in their daily life.  The industries and establishments that used steam engines were run on coal.  In 1855, the introduction of Railway brought coal from Raniganj which had high content of ash. It also polluted the air.  The fog in the city combined with smoke to create thick smog.  Due to marshy land, the resulting fog combined with smoke to generate thick smog.  Bengal Smoke Nuisance Commission controlled industrial pollution in Bengal. "
Why were reclamation projects undertaken in Bombay ? Explain any two such projects.  Or Why was the land reclamation in Bombay necessary ? Mention any two land reclamation projects taken up in Bombay. ,"The Reclamation in Bombay was necessary because :  When the islands of Bombay passed into British hands, the East India Company shifted its base from Surat to Bombay. Thus, Bombay became a major outlet for exports and it also became an important administration centre in Western India and by the end of the 19th century a major industrial centre.  With the growth of trade in cotton and opium large communities of trades and banks as well as artisans and shopkeepers came to settle in Bombay.  Bombay dominated the maritime trade of India till well into the twentieth century.  The railways encouraged an even higher scale of migration into the city. For instance, famine in dry region of Kutch drove large numbers of people into Bombay in 1888-89.  		Land Reclamation Projects :  Back Bay Reclamation : In 1864, the Back Bay Reclamation Company won the right to reclaim the western foreshore from the tip of Malabar hill to the end of Colaba.  Bombay Port Trust : A successful Reclamation project was undertaken by the Bombay Port Trust, which built a dry between 1914 and 1918 used the excavated earth to create the 22 acre Ballard Estate. Subsequently the famous Marine Drive of Bombay was developed."
What do you mean by “Land Reclamation”? Explain the history of land reclamation in Mumbai. 				 ,Reclamation means reclaiming of marshy or submerged areas for settlement or other use.  William Hornby approved the building of great sea wall.  Several plans by both government and private companies.  In 1864 the Back Bay Reclamation Company won the right to reclaim foreshore from Malabar Hill to Calaba.  Bombay Port Trust created 22 acre Ballard
“Bombay is a city of slums and star bungalows —a blend of dream and reality.” Justify the statement giving any five suitable arguments. ," Bombay films have contributed in a big way to produce an image of the city as a blend of dream and reality.  Rich industrialists and film producers owned spacious bungalows.  Bombay offered employment to both skilled and unskilled workers.  With the rapid and unplanned expansion of the city, the pressure on Bombay’s housing problem increased.  Refuge and waste products of large factories led to pollution.   The history of print in Europe.  The growth of press in 19th century India.  Relationship between print culture, public debate and politics. zz zz zz zz zz zz zz zz zz zz zz zz zz zz zz zz zz zz zz zz zz zz zz zz zz zz zz zz zz The earliest kind of print technology was developed in China, Japan and Korea. TOPIC - 1 The early system of printing was hand printing. Print Culture and the Modern World .... P. 39 Books in China were printed by rubbing paper against the inked surface of wooden blocks. TOPIC - 2 China was the major producer of printed materials. The Growth of Press in 19th Century Shanghai was the hub of the new print culture. India .... P. 44 The oldest Japanese book printed in A.D. 868, is the Buddhist ‘Diamond Sutra.’ In medieval Japan, poets and prose writers were regularly published and books were cheap and abundant. In the late 18th century, at Edo, illustrated collections of paintings depicted an elite urban culture. For centuries, silk and spices from China flowed into Europe through the silk route. In the 11th century, Chinese paper reached Europe via the silk route. At Strasbourg, Germany, Johann Gutenberg developed the first known printing press in the 1430s. The first book printed by Gutenberg was the Bible. One hundred eighty copies of this book were printed in three years. Printed books at first closely resembled the written manuscripts in appearance and layout. Luxury editions were still written by hand on a very expensive ‘Vellum’ meant for aristocratic circles. The print revolution transformed the lives of people. In 1517, the religious reformer Martin Luther wrote ‘Ninety Five Theses’ criticising the Catholic Church. Printing helped to spread the new ideas of Reformation. The Roman Church imposed severe controls over publishers and booksellers. In England, penny chap books were carried, by petty peddlers known as chapmen sold for a penny. In France, were the ‘Biliotheque Bleue’, which were low-priced small books. The periodical press, newspapers and journals carried information about wars and trade, as well as news of development in other places. The ideas and writings of the scientists like Isaac Newton, Thomas Paine, Voltaire and Jean Jacques Rousseau were printed and read. The French Revolution occurred as print helped the spread of ideas. Primary education became compulsory from the late 19th century, Children became an important category of readers. A children’s press, devoted to literature for children was set up in France in 1857. Penny magazines were specially meant for women. The best known novelists were Jane Austen, the Bronte Sisters, George Eliot. In the 19th century, libraries in England became instruments for educating the factory workers, artisans and lower middle-class people. zzSelf-educated working class people wrote political tracts and autobiographies. the late 18th century, the press came to be made out of metal. zzRichard M. Hoe of New York made the power driven cylindrical press, which was capable of printing 8,000 sheets per hour. This press was used for printing newspapers. zzIn the late 19th century, the offset press was developed. zzIn 1930s, publishers brought out cheap paperback editions. zzIndia had a very rich and old tradition of hand written manuscripts in Sanskrit, Arabic, Persian as well as in various vernacular languages. zzIn India, manuscripts were copied on palm leaves and on hand made paper. zzIn 1710, Dutch missionaries had printed 32 Tamil texts. zzFrom 1780, James Augustus Hickey began to edit the ‘Bengal Gazette’, a weekly magazine. zzBy the close of the 18th century, printing of many newspapers and journals started. zzIn the early 19th century, there were intense debates around existing religious issues. zzSome groups wanted reforms, while others were against them. zzThis was a time of intense controversies between social and religious reforms. zzThe reformers were focussed on the Hindu orthodoxy over matters like widow immolation, monotheism, Brahmanical priesthood and idolatry. zzMany newspapers such as “Sambad Kaumudi” in 1821  “Samachar Chandrika” (Hindu Orthodoxy), “Jam-i-Jahan Nama” and “Shamsul Akbar” from 1822  focussed on this matter. zzIn North India, the ‘Ulama’ used lithographic presses, published Persian and Urdu translation of holy scriptures, and printed religious newspapers and tracts to spread their religion. zzIn 1867, Deoband seminary was founded which published thousands of ‘Fatwas’ telling the code of conduct of Muslims and explaining the meanings of doctrines. zzPrint encouraged the reading of religious texts, especially in the vernacular languages. zzThe first printed edition of the Ramcharitmanas came out from Calcutta in 1810. zzNaval Kishore Press at Lucknow and the Shri Venkateshwar Press in Bombay published numerous religious texts in vernaculars. zzAt the end of the 19th century, a new visual culture was started. zzPainters like Raja Ravi Verma produced images for mass circulation. zzCheap prints and calenders were easily available in the market. zzBy the 1870’s, caricatures and cartoons were being published in journals and newspapers. zzIn 1860, few Bengali women like Kailashbashini Debi wrote books highlighting the experiences of women. zzHindi printing began from the 1870s. zzIn Punjab, folk literature was printed from the early 20th century. zzIn Bengal, the Battala was devoted to the printings of popular books, peddlers took the Battala publications to homes, enabling women to read in leisure time. zzPublic libraries were set up in the early 20th century. zzLocal protest movements created a lot of popular journals. zzAfter the revolt of 1857, the attitude to freedom of the press changed. zzIn 1878, the Vernacular Press Act was passed. zzIn 1907, Bal Gangadhar Tilak wrote with great sympathy about Punjab revolution in his “Kesari”. This led to his imprisonment in 1908. zzBy zzCalligraphy : The art of beautiful and stylish writing. : The person who composes the text for printing. zzDespotism : A system of governance in which absolute power is exercised by an individual, unregulated by legal and constitutional checks. zzAlmanac : An annual publication giving astronomical data, information about the movements of the sun and moon, timing of full tides and eclipses, and much else that was of importance in the everyday life of people. zzDenominations : Sub-groups with a religion. zzAnthology : A collection of poems, stories etc. that have been written by different people and published together in a book. zzGalley : Metal frame in which types are laid and the text composed. zzChapbooks : Pocket size books that were popular in the 16th century print revolution. zzManuscript : Book or document written by hand. It can also be termed as author’s original copy - handwritten or typed but not printed. zzCompositor zzBallad : A historical account or folk tale in verse, usually sung or recited. : Story of one’s own life written by the author himself or herself. zzInquisition : A former Roman Catholic court for identifying and punishing heretics. zzHeretical : Beliefs which do not follow the accepted teachings of the Church. zzSatiety : The state of being fulfilled much beyond the point of satisfaction. zzFatwa : A legal pronouncement of Islamic law usually given by a mufti  to clarify issues on which the law is uncertain. zzSeditions : Action, speech or writing that oppose the government. zzTaverns : Places where people gathered to drink alcohol to be served food and to meet friends and exchange news. zzProtestant Reformation : A movement to reform the Catholic Church. zzLithography : The process of printing from a smooth surface, viz., a metal plate, that has been specially prepared so that ink only sticks to the design to be printed. zzRevolution : Cause to change fundamentally. zzUlama : Legal scholars of Islam and the Sharia . zzVellum : A parchment made from the skin of animals. zzNew Testament : The second part of the Bible, that describes the life and the teachings of Jesus Christ. zzScribes : Skilled hand writers of manuscripts. zzPlaten : In letterpress printing, platen is a board which is pressed onto the back of the paper to get the impression from the type. At one time it used to be a wooden board, later it was made of steel. zzParchment : Skin of animals like goat or sheep specially prepared for the purpose of writing, painting, etc. zzAutobiography zz594 : Books in China were printed by rubbing paper against the inked surface of woodblocks. : Hand printing technology was introduced in Japan. zz868 : The first Japanese book ‘The Diamond Sutra’ was printed. zz11th century : Paper reached Europe from China. zz1295 : Marco Polo brought the knowledge of producing books with woodblocks to Europe from China. zz1448 : Johann Gutenberg invented the printing press. zz1450-1550 : Printing presses set up in most countries of Europe. zz1517 : Religious reformer Martin Luther printed ‘Ninety Five Theses’, criticizing many of the practices and rituals of the Romann Catholic Church, starting the ‘Protestant Reformation’. zz1558 : The Roman Church began maintaining an index of prohibited books. zz1713 : First Malyalam book was published in Cochin by the Catholic priests. zz1780 : James Augustus Hickey began to edit the Bengal Gazette. It was a weekly magazine. zz1791 : James Lackington wrote in his diary about the tremendous increase in the sale of books. zz1810 : The first printing edition of the Ramcharitmanas of Tulsidas came out from Calcutta. zz1812 : Fairy Tales were printed by the Grimm brothers. zz1821 : Raja Rammohan Roy published the Sambad Kaumudi. zz1822 : Two Persian newspapers ‘Jam-i-Jahan Nama’ and ‘Shamsul Akbar’ were published. zz1843 : Steam powered rotary printing press, suitable for printing newspapers was invented by Richard Hoe. zz1878 : The Vernacular Press Act was passed in India. zz1880s : Tarabai Shinde and Pandita Ramabai wrote about the miserable lives of upper-caste Hindu women, especially widows. zz1926 : Begum Rokeya Sakhawat Hossein, an educationist and literary figure, strongly condemned men for withholding education from women. zz768-770 1. History of Printing and Printing Processes. 		  http://inventors.about.com 		  http://www.bpsnet.org.uk 2. The Print Media 		http://download.nos.org The earliest kind of technology was a system of hand-printing. It was developed in China, Japan and Korea. Shanghai became the hub of the new print culture. In the 11th century, Chinese paper reached Europe via the silk route. Johann Gutenberg invented the olive printing press which provided the model for the printing press. With the printing press, a new reading public emerged in the world. Through the 17th & 18th centuries, literacy rates went up in various parts of Europe. In England, penny chap books were carried, by petty peddlers known as chapmen sold for a penny. In France, were the 'Biliotheque Blue', which were low priced small books printed on poor quality paper. The discoveries of Isaac Newton and the writings of thinkers such as Thomas Paine, Voltaire and Jean Jacques Rousseau were widely printed and read. Print created a new culture of dialogue and debate. Through the 19th century, there were a series of further innovations in printing technology. India had a very rich and old tradition of handwritten manuscripts in different languages. Manuscripts were copied on palm leaves or on handmade paper. The first printing press came to Goa  with Portuguese missionaries in the mid 16th century. After the Revolt of 1857, the attitude to freedom of the press changed. Eraged Englishmen demanded a clamp down on the 'native' press. In 1878, the Vernacular Press Act was passed , modelled on the Irish Press Laws. This act provided the government with extensive right to censor report and editorials. Public libraries were set up from the early 20th century, expanding the access to books. Social reformers like Jyotiba Phule wrote about the injustices of caste system in his book Gulamgiri."
