,questions,answers
0,Q. 1. Name a leader of the Dalits and the association formed by him.,"Ans. Dr B.R. Ambedkar, Depressed Classes Association in 1930."
1,Q. 2. By whom was the first image of Bharat Mata painted ?,Ans. Abanindranath Tagore.
2,Q. 3. Why had Congress ignored the dalits for long ?,Ans. For fear of offending the Sanatanis.
3,Q. 4. Which Muslim leader was willing to give up the demand for separate electorates ?,Ans. Mohammad Ali Jinnah.
4,Q. 5. Why did Gandhiji begin fast unto death when Dr. B.R. Ambedkar demanded separate electorate for Dalits ?,Ans. Separate electorate would create divisions in the society.
5,Q. 6. Who was the writer of ‘Vande Matram’?,Ans. Bankim Chandra Chattopadhyay.
