questions,answers
How does democracy produce an accountable government ?,"In an accountable government, people have the right to elect the leaders to form government and if possible they participated in decision making process."
How can you say that democracies are based on political equality ?  ,All individuals have equal weight in electing representatives. 
Name the law which empowers the people to find out what is happening in government.,Right to Information Act.
What does a political outcome signify ?,Restricted popular participation.
What is the basic element of democracy ?,Universal adult franchise.
