,questions,answers
0,Q. 1. Why are MNCs setting their customer care centers in India ? ,Ans. MNCs are setting up their customer care centers in India due to availability of cheap skilled labour and good English speaking people.
1,Q. 2. Due to which reason the latest models of different items are available within our reach ? ,"Ans. Due to globalisation, the latest l atest models of digital camera, mobile phone, TV etc are available with us."
2,Q. 3. How many countries are currently the members of the World Trade Organization  ? 1 mark each,"Ans. It has 164 member countries as on 29 July, 2016."
3,"Q. 4. In which year, the government started to remove barriers on foreign trade and foreign investment.",Ans. In 1991.
4,Q. 5. Why are the Chinese toys popular in the world ?,Ans. Chinese toys are comparatively cheaper and have new designs. That is why they are popular in the world.
5,Q. 6. Name the organization which lay emphasis on liberalisation of foreign trade and foreign investment in India.,Ans. World Trade Organization .
6,Q. 7. Where is the main Head Office of WTO ?,Ans. Geneva-Switzerland.
