questions,answers
Name the news paper started by Bal Gangadhar Tilak in India in the 19th century. ,‘Kesari’ was the news paper started by the Bal Gangadhar Tilak in India during 19th century. 1 
"What did political leaders and reformers like Jyotiba Phule, Gandhiji, B.R. Ambedker and Periyar Ramaswamy oppose ? ","Discrimination against the outcaste groups, caste inequalities."
Who wrote the autobiography ‘Amar Jiban’ published in 1876 ?,Rash Sundari Debi.
When did the first printing press come to India,In the middle of the 16th century.
Name the first weekly paper published in India.,Bengal Gazette.
By whom was the printing press first introduced introduced in India ?,Port Portuguese uguese missionaries.
